Symbol,Name,Last Sale,Net Change,% Change,Market Cap,Country,IPO Year,Volume,Sector,Industry
HUBS,HubSpot Inc. Common Stock,$467.77,-1.13,-0.241%,21464853878.0,United States,2014.0,826984,Technology,Computer Software: Prepackaged Software
HUM,Humana Inc. Common Stock,$403.13,0.01,0.002%,52008025843.0,United States,,921435,Health Care,Medical Specialities
HUN,Huntsman Corporation Common Stock,$28.89,1.24,4.485%,6384703174.0,United States,2005.0,2387575,Basic Industries,Major Chemicals
HUYA,HUYA Inc. American depositary shares each  representing one Class A ordinary share,$25.55,-0.66,-2.518%,6011851151.0,United States,2018.0,1837966,Technology,Computer Software: Programming Data Processing
HVT,Haverty Furniture Companies Inc. Common Stock,$37.99,0.37,0.984%,691860925.0,United States,,171012,Consumer Services,Other Specialty Stores
HVT/A,Haverty Furniture Companies Inc.,$38.43,0.44,1.158%,,United States,,344,,
HWM,Howmet Aerospace Inc. Common Stock,$32.16,1.02,3.276%,13945047691.0,United States,,3269092,Capital Goods,Metal Fabrications
HXL,Hexcel Corporation Common Stock,$64.16,3.03,4.957%,5366973863.0,United States,,1361705,Basic Industries,Major Chemicals
HY,Hyster-Yale Materials Handling Inc. Class A Common Stock,$91.24,-0.74,-0.805%,1533939654.0,United States,,68186,Capital Goods,Construction/Ag Equipment/Trucks
HYB,New America High Income Fund Inc. (The) Common Stock,$8.92,-0.0199,-0.223%,208450749.0,United States,1988.0,12917,,
HYI,Western Asset High Yield Defined Opportunity Fund Inc. Common Stock,$15.34,0.04,0.261%,347473151.0,,2010.0,42636,,
HYLN,Hyliion Holdings Corp. Class A Common Stock,$13.57,-0.42,-3.002%,2310363064.0,,2019.0,4765513,Capital Goods,Construction/Ag Equipment/Trucks
HYT,Blackrock Corporate High Yield Fund Inc. Common Stock,$11.45,0.0,0.00%,1395801441.0,United States,2003.0,303715,,
HZAC,Horizon Acquisition Corporation Class A Ordinary Shares,$10.16,0.01,0.099%,690860097.0,United States,2020.0,50960,Finance,Business Services
HZN,Horizon Global Corporation Common Shares,$10.38,-0.36,-3.352%,279441869.0,United States,2015.0,99451,Capital Goods,Auto Parts:O.E.M.
HZO,MarineMax Inc.  (FL) Common Stock,$61.77,0.5,0.816%,1367326822.0,United States,1998.0,499566,Consumer Services,Other Specialty Stores
HZON,Horizon Acquisition Corporation II Class A Ordinary Shares,$10.84,-0.04,-0.368%,711375000.0,United States,2020.0,1055166,Finance,Business Services
IAA,IAA Inc. Common Stock ,$56.99,-1.36,-2.331%,7668144069.0,,2019.0,941145,Consumer Durables,Automotive Aftermarket
IACA,ION Acquisition Corp 1 Ltd. Class A Ordinary Shares,$10.84,-0.09,-0.823%,350606250.0,Israel,2020.0,106861,Finance,Business Services
IAE,Voya Asia Pacific High Dividend Equity Income Fund ING Asia Pacific High Dividend Equity Income Fund Common Shares of Beneficial Interest,$9.50,0.0,0.00%,113039113.0,United States,2007.0,59460,,
IAG,Iamgold Corporation Ordinary Shares,$3.37,0.08,2.432%,1601761000.0,Canada,,10176361,Basic Industries,Precious Metals
IBA,Industrias Bachoco S.A.B. de C.V. Common Stock,$40.45,0.53,1.328%,2022500000.0,Mexico,1997.0,5657,Consumer Non-Durables,Meat/Poultry/Fish
IBM,International Business Machines Corporation Common Stock,$129.03,0.79,0.616%,115300445433.0,United States,,4289394,Technology,Computer Manufacturing
IBN,ICICI Bank Limited Common Stock,$16.41,-0.3,-1.795%,56735181782.0,India,,7236830,Finance,Commercial Banks
IBP,Installed Building Products Inc. Common Stock,$116.96,2.76,2.417%,3464705846.0,,2014.0,160309,Basic Industries,Homebuilding
ICD,Independence Contract Drilling Inc. Common Stock,$4.44,-0.03,-0.671%,27513406.0,,2014.0,120299,Energy,Oil & Gas Production
ICE,Intercontinental Exchange Inc. Common Stock,$113.70,-0.96,-0.837%,63866042239.0,United States,2005.0,2027397,Finance,Investment Bankers/Brokers/Service
ICL,ICL Group Ltd. Ordinary Shares,$5.98,-0.04,-0.664%,7658891859.0,Israel,2014.0,127644,Basic Industries,Agricultural Chemicals
IDA,IDACORP Inc. Common Stock,$99.68,-2.92,-2.846%,5030773245.0,United States,,480413,Public Utilities,Electric Utilities: Central
IDE,Voya Infrastructure Industrials and Materials Fund Common Shares of Beneficial Interest,$12.20,-0.05,-0.408%,232698994.0,United States,2010.0,82747,,
IDT,IDT Corporation Class B Common Stock,$22.56,-0.18,-0.792%,580363738.0,United States,,106969,Public Utilities,Telecommunications Equipment
IEX,IDEX Corporation Common Stock,$197.22,-1.52,-0.765%,14966973931.0,United States,1989.0,691617,Capital Goods,Fluid Controls
IFF,Internationa Flavors & Fragrances Inc. Common Stock,$137.85,1.17,0.856%,34286914390.0,United States,,1447002,Basic Industries,Major Chemicals
IFFT,International Flavors & Fragrances Inc. 6.00% Tangible Equity Units,$48.79,0.15,0.308%,0.0,United States,2018.0,51968,Basic Industries,Major Chemicals
IFN,India Fund Inc. (The) Common Stock,$21.86,-0.06,-0.274%,588134010.0,United States,,86167,,
IFS,Intercorp Financial Services Inc. Common Shares,$30.55,-0.08,-0.261%,3526172650.0,,2019.0,37455,Finance,Commercial Banks
IGA,Voya Global Advantage and Premium Opportunity Fund Common Shares of Beneficial Interest,$9.35,-0.02,-0.213%,170444114.0,United States,2005.0,45679,,
IGD,Voya Global Equity Dividend and Premium Opportunity Fund,$5.64,0.03,0.535%,545266204.0,United States,2005.0,245395,,
IGI,Western Asset Investment Grade Defined Opportunity Trust Inc. Common Stock,$21.13,-0.07,-0.33%,229102448.0,United States,2009.0,19548,,
IGR,CBRE Clarion Global Real Estate Income Fund Common Stock,$7.67,0.01,0.131%,894249089.0,United States,2004.0,449555,,
IGT,International Game Technology Ordinary Shares,$19.40,0.84,4.526%,3975060000.0,United States,2015.0,4914278,Consumer Services,Services-Misc. Amusement & Recreation
IH,iHuman Inc. American depositary shares each representing five Class A ordinary shares,$15.10,-0.35,-2.265%,789344588.0,United States,2020.0,33526,Consumer Services,Other Consumer Services
IHC,Independence Holding Company Common Stock,$41.44,-0.71,-1.684%,606592504.0,United States,,5820,Finance,Life Insurance
IHD,Voya Emerging Markets High Income Dividend Equity Fund Common Shares,$8.13,-0.01,-0.123%,154789420.0,United States,2011.0,57076,,
IHG,Intercontinental Hotels Group American Depositary Shares (Each representing one Ordinary Share),$72.63,0.61,0.847%,13307000741.0,United Kingdom,,92266,Consumer Services,Hotels/Resorts
IHIT,Invesco High Income 2023 Target Term Fund Common Shares of Beneficial Interest,$9.37,0.06,0.644%,225422073.0,United States,2016.0,125606,,
IHTA,Invesco High Income 2024 Target Term Fund Common Shares of Beneficial Interest No par value per share,$9.75,-0.22,-2.207%,85606297.0,,2017.0,47948,,
IIAC,Investindustrial Acquisition Corp. Class A Ordinary Shares,$9.88,-0.04,-0.403%,497087500.0,United Kingdom,2021.0,71337,Finance,Business Services
IID,Voya International High Dividend Equity Income Fund Common Shares of Beneficial Interest,$5.51,-0.0001,-0.002%,45871599.0,United States,2007.0,13816,,
IIF,Morgan Stanley India Investment Fund Inc. Common Stock,$23.69,-0.23,-0.962%,268164427.0,United States,1994.0,20203,,
IIIN,Insteel Industries Inc. Common Stock,$36.92,-0.65,-1.73%,713071662.0,United States,,104495,,
IIM,Invesco Value Municipal Income Trust Common Stock,$15.60,-0.02,-0.128%,734081681.0,United States,,106212,,
IIPR,Innovative Industrial Properties Inc. Common Stock,$194.25,2.11,1.098%,4647687077.0,United States,2016.0,352562,Finance,Real Estate
IIPR^A,Innovative Industrial Properties Inc. 9.00% Series A Cumulative Redeemable Preferred Stock,$31.08,0.88,2.914%,,United States,,621,,
IMAX,Imax Corporation Common Stock,$21.24,-0.06,-0.282%,1252073128.0,Canada,,3807724,Miscellaneous,Industrial Machinery/Components
IMPX,AEA-Bridges Impact Corp. Class A Ordinary Shares,$9.91,-0.01,-0.101%,510365000.0,,2020.0,194337,Finance,Business Services
INFO,IHS Markit Ltd. Common Shares,$95.80,0.47,0.493%,37993506128.0,Bermuda,1996.0,2061443,Technology,Computer Software: Programming Data Processing
INFY,Infosys Limited American Depositary Shares,$19.10,-0.23,-1.19%,81067360842.0,India,,9003979,Technology,EDP Services
ING,ING Group N.V. Common Stock,$12.26,0.24,1.997%,47822197465.0,Netherlands,1997.0,8339387,Finance,Commercial Banks
INGR,Ingredion Incorporated Common Stock,$92.40,0.37,0.402%,6201012325.0,United States,,281808,Consumer Non-Durables,Packaged Foods
INN,Summit Hotel Properties Inc. Common Stock,$11.25,0.4,3.687%,1189223854.0,United States,2011.0,961260,Consumer Services,Real Estate Investment Trusts
INN^D,Summit Hotel Properties Inc. 6.45% Series D Cumulative Redeemable Preferred Stock,$24.4674,0.1574,0.647%,,United States,,611,,
INN^E,Summit Hotel Properties Inc. 6.250% Series E Cumulative Redeemable Preferred Stock,$24.20,0.05,0.207%,,United States,,11286,,
INSI,Insight Select Income Fund,$20.48,-0.0729,-0.355%,219341517.0,United States,,8395,,
INSP,Inspire Medical Systems Inc. Common Stock,$222.67,6.03,2.783%,6040718014.0,United States,1998.0,209430,Health Care,Medical/Dental Instruments
INSW,International Seaways Inc. Common Stock ,$21.58,0.16,0.747%,604561046.0,,2016.0,309872,Consumer Services,Marine Transportation
INSW^A,International Seaways Inc. 8.50% Senior Notes due June 30 2023,$25.7106,0.0706,0.275%,,,,505,,
INT,World Fuel Services Corporation Common Stock,$36.76,1.06,2.969%,2320459561.0,United States,,475958,Energy,Oil Refining/Marketing
INVH,Invitation Homes Inc. Common Stock,$30.99,-0.14,-0.45%,17578161188.0,United States,2017.0,2221898,Finance,Real Estate
IO,Ion Geophysical Corporation Common Stock,$3.00,-0.07,-2.28%,53890215.0,United States,,346104,Energy,Oil & Gas Production
IP,International Paper Company Common Stock,$54.16,1.11,2.092%,21291223057.0,United States,,2553088,Basic Industries,Paper
IPG,Interpublic Group of Companies Inc. (The) Common Stock,$29.93,0.65,2.22%,11692990415.0,United States,,5813797,Technology,Advertising
IPI,Intrepid Potash Inc Common Stock,$37.85,1.62,4.471%,507645563.0,United States,2008.0,186429,Basic Industries,Mining & Quarrying of Nonmetallic Minerals (No Fuels)
IPOD,Social Capital Hedosophia Holdings Corp. IV Class A Ordinary Shares,$11.82,-0.28,-2.314%,679650000.0,United States,2020.0,611098,Finance,Business Services
IPOE,Social Capital Hedosophia Holdings Corp. V Class A Ordinary Shares,$19.15,0.7,3.794%,1926968750.0,United States,2020.0,3642391,Finance,Investment Bankers/Brokers/Service
IPOF,Social Capital Hedosophia Holdings Corp. VI Class A Ordinary Shares,$11.63,-0.06,-0.513%,1671812500.0,United States,2020.0,1999107,Finance,Business Services
IQI,Invesco Quality Municipal Income Trust Common Stock,$12.89,-0.05,-0.386%,681672143.0,United States,,67374,,
IQV,IQVIA Holdings Inc. Common Stock,$189.71,0.32,0.169%,36380140335.0,United States,2013.0,726754,Health Care,Biotechnology: Commercial Physical & Biological Resarch
IR,Ingersoll Rand Inc. Common Stock,$49.78,0.84,1.716%,20846106517.0,United States,2017.0,1286268,Technology,Industrial Machinery/Components
IRL,New Ireland Fund Inc (The) Common Stock,$11.41,0.26,2.332%,56123599.0,United States,1990.0,15069,,
IRM,Iron Mountain Incorporated (Delaware)Common Stock REIT,$36.19,0.41,1.146%,10437963771.0,United States,,2637452,Consumer Services,Real Estate Investment Trusts
IRR,Voya Natural Resources Equity Income Fund Common Shares of Beneficial Interest,$3.14,0.02,0.641%,70172375.0,United States,,36811,,
IRS,IRSA Inversiones Y Representaciones S.A. Common Stock,$4.21,0.15,3.695%,243622790.0,Argentina,,19342,Consumer Services,Homebuilding
IRT,Independence Realty Trust Inc. Common Stock,$15.13,0.15,1.001%,1541095608.0,United States,2013.0,681067,Consumer Services,Real Estate Investment Trusts
ISD,PGIM High Yield Bond Fund Inc.,$15.50,-0.07,-0.45%,515479238.0,United States,2012.0,66593,,
IT,Gartner Inc. Common Stock,$184.50,-2.91,-1.553%,16369125606.0,United States,1993.0,511105,Consumer Services,Other Consumer Services
ITCB,Itau CorpBanca American Depositary Shares (each representing 1500 shares of Common Stock no par value),$5.98,-0.16,-2.606%,2042794946.0,Chile,,39025,Finance,Commercial Banks
ITGR,Integer Holdings Corporation Common Stock,$91.63,-0.52,-0.564%,3019853117.0,United States,,81864,Miscellaneous,Industrial Machinery/Components
ITT,ITT Inc. Common Stock ,$89.07,2.05,2.356%,7704555000.0,United States,2011.0,288711,Capital Goods,Fluid Controls
ITUB,Itau Unibanco Banco Holding SA American Depositary Shares (Each repstg 500 Preferred shares),$4.96,0.2,4.202%,48421786204.0,Brazil,,48625194,Finance,Major Banks
ITW,Illinois Tool Works Inc. Common Stock,$219.90,1.38,0.632%,69634031634.0,United States,,1139392,Technology,Industrial Machinery/Components
IVAN,Ivanhoe Capital Acquisition Corp. Class A Ordinary Shares,$10.1999,-0.0001,-0.001%,351896550.0,,2021.0,138403,Finance,Business Services
IVC,Invacare Corporation Common Stock,$8.53,0.09,1.066%,293638162.0,United States,,522101,Health Care,Industrial Specialties
IVH,Ivy High Income Opportunities Fund Common Shares of Beneficial Interest,$13.60,0.01,0.074%,225355196.0,,2013.0,42057,,
IVR,INVESCO MORTGAGE CAPITAL INC Common Stock,$4.07,0.11,2.778%,939445980.0,United States,2009.0,9572403,Consumer Services,Real Estate Investment Trusts
IVR^A,Invesco Mortgage Capital Inc. Pfd Ser A,$24.78,-0.1,-0.402%,,United States,,21694,,
IVR^B,Invesco Mortgage Capital Inc. Preferred Series B Cum Fxd to Fltg,$23.89,-0.0399,-0.167%,,United States,,3718,,
IVR^C,INVESCO MORTGAGE CAPITAL INC 7.5% Fixed-to-Floating Series C Cumulative Redeemable Preferred Stock Liquation Preference $25.00 per Share,$24.16,-0.107,-0.441%,,United States,,11475,,
IVZ,Invesco Ltd Common Stock,$25.51,0.26,1.03%,11710933404.0,United States,,4553634,Finance,Investment Managers
IX,Orix Corp Ads Common Stock,$88.01,1.31,1.511%,21465509097.0,Japan,,21529,Finance,Diversified Financial Services
J,Jacobs Engineering Group Inc. Common Stock,$125.32,0.79,0.634%,16302397697.0,United States,,413619,Basic Industries,Military/Government/Technical
JAX,J. Alexander's Holdings Inc. Common Stock,$9.86,0.32,3.354%,148590959.0,,2015.0,81401,Consumer Services,Restaurants
JBGS,JBG SMITH Properties Common Shares ,$32.89,0.03,0.091%,4328352220.0,United States,2017.0,509383,Consumer Services,Real Estate Investment Trusts
JBK,Lehman ABS 3.50 3.50% Adjustable Corp Backed Tr Certs GS Cap I,$29.25,0.0,0.00%,0.0,United States,,250,Finance,Finance: Consumer Services
JBL,Jabil Inc. Common Stock,$51.02,0.55,1.09%,7661979469.0,United States,1993.0,1263544,Technology,Electrical Products
JBT,John Bean Technologies Corporation Common Stock,$140.46,1.12,0.804%,4456758719.0,United States,,143263,Technology,Industrial Machinery/Components
JCE,Nuveen Core Equity Alpha Fund Nuveen Core Equity Alpha Fund Common Shares of Beneficial Interest,$14.86,0.03,0.202%,238195116.0,United States,2007.0,46800,,
JCI,Johnson Controls International plc Ordinary Share,$60.52,-0.05,-0.083%,43475831560.0,Switzerland,,5740570,Consumer Services,Other Consumer Services
JCO,Nuveen Credit Opportunities 2022 Target Term Fund Common Shares of Beneficial Interest,$8.41,0.0,0.00%,233381638.0,United States,2017.0,53586,,
JDD,Nuveen Diversified Dividend and Income Fund Shares of Beneficial Interest,$9.25,0.01,0.108%,181933782.0,United States,2003.0,36091,,
JE,Just Energy Group Inc. Ordinary Shares (Canada),$1.74,0.06,3.571%,83656828.0,Canada,,5277287,Public Utilities,Oil/Gas Transmission
JEF,Jefferies Financial Group Inc. Common Stock,$34.28,0.92,2.758%,8569585829.0,United States,,1506005,Finance,Investment Bankers/Brokers/Service
JELD,JELD-WEN Holding Inc. Common Stock,$29.46,1.08,3.805%,2947056170.0,United States,2017.0,550379,Basic Industries,Forest Products
JEMD,Nuveen Emerging Markets Debt 2022 Target Term Fund Common Shares of Beneficial Interest $0.01 par value per share,$7.85,-0.01,-0.127%,111838887.0,,2017.0,16296,,
JEQ,Aberdeen Japan Equity Fund Inc.  Common Stock,$9.18,0.1,1.101%,123090360.0,United States,1992.0,14773,,
JFR,Nuveen Floating Rate Income Fund Common Stock,$9.64,0.04,0.417%,548694032.0,United States,2004.0,447907,,
JGH,Nuveen Global High Income Fund Common Shares of Beneficial Interest,$15.66,0.0,0.00%,362957974.0,United States,2014.0,41546,,
JHAA,Nuveen Corporate Income 2023 Target Term Fund,$9.95,-0.15,-1.485%,77863317.0,,2018.0,3381,,
JHB,Nuveen Corporate Income November 2021 Target Term Fund,$9.34,0.01,0.107%,522106458.0,,2016.0,218902,,
JHG,Janus Henderson Group plc Ordinary Shares,$32.23,0.61,1.929%,5554840145.0,,2017.0,734119,Finance,Investment Managers
JHI,John Hancock Investors Trust Common Stock,$17.93,0.07,0.392%,156116958.0,United States,,4516,,
JHS,John Hancock Income Securities Trust Common Stock,$15.49,-0.03,-0.193%,180405586.0,United States,,12370,,
JHX,James Hardie Industries plc American Depositary Shares (Ireland),$30.14,0.21,0.702%,13387208118.0,Ireland,,18643,Capital Goods,Building Materials
JIH,Juniper Industrial Holdings Inc. Class A Common Stock,$12.60,-0.23,-1.793%,543375000.0,,2019.0,283327,Finance,Business Services
JILL,J. Jill Inc. Common Stock,$7.96,0.14,1.79%,76574006.0,,2017.0,963816,Consumer Non-Durables,Apparel
JKS,JinkoSolar Holding Company Limited American Depositary Shares (each representing 4 Common Shares),$44.67,-1.25,-2.722%,2023276235.0,China,2010.0,2349110,Technology,Semiconductors
JLL,Jones Lang LaSalle Incorporated Common Stock,$179.61,3.32,1.883%,9180005400.0,United States,,185087,Finance,Real Estate
JLS,Nuveen Mortgage and Income Fund,$20.64,-0.06,-0.29%,113260762.0,United States,2009.0,5364,,
JMIA,Jumia Technologies AG American Depositary Shares each representing two Ordinary Shares,$50.08,1.91,3.965%,4488651520.0,,2019.0,5245641,Consumer Services,Catalog/Specialty Distribution
JMM,Nuveen Multi-Market Income Fund (MA),$7.23,-0.0025,-0.035%,68412798.0,United States,,346,,
JMP,JMP Group LLC Common Shares,$5.87,0.21,3.71%,116167300.0,United States,2007.0,55892,Finance,Investment Bankers/Brokers/Service
JNJ,Johnson & Johnson Common Stock,$160.77,-0.6,-0.372%,423260235259.0,United States,,5999871,Health Care,Major Pharmaceuticals
JNPR,Juniper Networks Inc. Common Stock,$25.40,-0.15,-0.587%,8335571315.0,United States,1999.0,3849629,Technology,Computer Communications Equipment
JOE,St. Joe Company (The) Common Stock,$48.14,0.33,0.69%,2834605909.0,United States,,255939,Consumer Services,Homebuilding
JOF,Japan Smaller Capitalization Fund Inc Common Stock,$9.40,0.06,0.642%,266338594.0,United States,1990.0,101338,,
JP,Jupai Holdings Limited American Depositary Shares each representing six ordinary shares,$2.72,0.19,7.51%,91702942.0,,2015.0,464800,Consumer Services,Other Consumer Services
JPC,Nuveen Preferred & Income Opportunities Fund,$9.14,0.03,0.329%,944666062.0,United States,2003.0,516021,,
JPI,Nuveen Preferred and Income Term Fund Common Shares of Beneficial Interest,$24.68,0.1,0.407%,561751130.0,,2012.0,30468,,
JPM,JP Morgan Chase & Co. Common Stock,$155.09,1.58,1.029%,473258133159.0,United States,,13948692,Finance,Major Banks
JPM^C,J P Morgan Chase & Co Depositary Shares each representing a 1/400th interest in a share of 6.00% Non-Cumulative  Preferred Stock Series EE,$27.59,0.0089,0.032%,,United States,,95929,,
JPM^D,J P Morgan Chase & Co Depositary Shares each representing a 1/400th  interest in a share of 5.75% Non-Cumulative  Preferred Stock Series DD,$27.42,0.235,0.864%,,United States,,145101,,
JPM^G,J P Morgan Chase & Co Depositary Shares each representing a 1/400th interest in a share of 6.10% Non-Cumulative Preferred Stock Series AA,$25.45,-0.07,-0.274%,,United States,,110752,,
JPM^H,J P Morgan Chase & Co Depositary Shares each representing a 1/400th interest in a share of 6.15% Non-Cumulative Preferred Stock Series BB,$25.46,0.0,0.00%,,United States,,71320,Finance,Major Banks
JPM^J,J P Morgan Chase & Co Depositary Shares each representing a 1/400th interest in a share of JPMorgan Chase & Co. 4.75% Non-Cumulative Preferred Stock Series GG,$26.23,0.0,0.00%,,United States,,91180,Finance,Major Banks
JPS,Nuveen Preferred & Income Securities Fund,$9.34,0.01,0.107%,1903399973.0,United States,2002.0,519731,,
JPT,Nuveen Preferred and Income 2022 Term Fund Common Shares of Beneficial Interest,$24.34,0.0,0.00%,166511692.0,United States,2017.0,12853,,
JQC,Nuveen Credit Strategies Income Fund Shares of Beneficial Interest,$6.39,0.01,0.157%,866543363.0,United States,2003.0,797748,,
JRI,Nuveen Real Asset Income and Growth Fund Common Shares of Beneficial Interest,$14.47,-0.06,-0.413%,397254750.0,United States,2012.0,83591,,
JRO,Nuveen Floating Rate Income Opportuntiy Fund Shares of Beneficial Interest,$9.49,-0.01,-0.105%,384736159.0,United States,2004.0,141492,,
JRS,Nuveen Real Estate Income Fund Common Shares of Beneficial Interest,$9.37,-0.07,-0.742%,270722453.0,United States,2001.0,76075,,
JSD,Nuveen Short Duration Credit Opportunities Fund Common Shares of Beneficial Interest,$14.18,0.0,0.00%,143014489.0,United States,2011.0,24910,,
JT,Jianpu Technology Inc. American depositary shares,$2.74,0.01,0.366%,57907672.0,,2017.0,154834,Technology,Computer Software: Programming Data Processing
JTA,Nuveen Tax-Advantaged Total Return Strategy Fund Common Share of Beneficial Interest,$10.55,0.01,0.095%,146126963.0,United States,2004.0,50366,,
JTD,Nuveen Tax-Advantaged Dividend Growth Fund Common Shares of Beneficial Interest,$14.82,0.03,0.203%,214657919.0,United States,,34543,,
JW/A,John Wiley & Sons Inc.,$50.72,0.43,0.855%,,United States,,700147,,
JW/B,John Wiley & Sons Inc.,$50.73,0.17,0.336%,,United States,,1543,,
JWN,Nordstrom Inc. Common Stock,$43.94,-0.92,-2.051%,6933732000.0,United States,,2869732,Consumer Services,Clothing/Shoe/Accessory Stores
JWS,Jaws Acquisition Corp. Class A Ordinary Shares,$13.13,-0.27,-2.015%,1132462500.0,,2020.0,658879,Health Care,Medical/Nursing Services
K,Kellogg Company Common Stock,$60.38,0.02,0.033%,20550659052.0,United States,,1920189,Consumer Non-Durables,Packaged Foods
KAI,Kadant Inc Common Stock,$177.03,0.47,0.266%,2043322747.0,United States,,30518,Technology,Industrial Machinery/Components
KAMN,Kaman Corporation Common Stock,$55.25,1.71,3.194%,1532146259.0,United States,,129433,Capital Goods,Military/Government/Technical
KAR,KAR Auction Services Inc Common Stock,$16.28,0.1,0.618%,2111548625.0,United States,2009.0,1319586,Consumer Durables,Automotive Aftermarket
KB,KB Financial Group Inc,$45.54,0.72,1.606%,17971647616.0,South Korea,,275738,Finance,Commercial Banks
KBH,KB Home Common Stock,$47.37,2.14,4.731%,4682558843.0,United States,1986.0,1477924,Capital Goods,Homebuilding
KBR,KBR Inc. Common Stock,$33.21,0.59,1.809%,4677421402.0,United States,2006.0,1080892,Basic Industries,Military/Government/Technical
KEN,Kenon Holdings Ltd. Ordinary Shares,$30.95,0.239,0.778%,1667312371.0,Singapore,2015.0,2313,Public Utilities,Electric Utilities: Central
KEP,Korea Electric Power Corporation Common Stock,$11.00,0.03,0.273%,14123209694.0,South Korea,1994.0,131446,Public Utilities,Electric Utilities: Central
KEX,Kirby Corporation Common Stock,$68.35,0.22,0.323%,4106882474.0,United States,,186941,Consumer Services,Marine Transportation
KEY,KeyCorp Common Stock,$20.38,0.07,0.345%,19744452798.0,United States,,11510874,Finance,Major Banks
KEY^I,KeyCorp Depositary Shares Each Representing a 1/40th Ownership Interest in a Share of Fixed-to-Floating Rate Perpetual Non-Cumulative Preferred Stock Series E,$29.84,0.04,0.134%,,United States,,32756,,
KEY^J,KeyCorp Depositary Shares each representing a 1/40th ownership interest in a share of Fixed Rate Perpetual Non-Cumulative Preferred Stock Series F,$27.05,0.02,0.074%,,United States,,31188,,
KEY^K,KeyCorp Depositary Shares each representing a 1/40th ownership interest in a share of Fixed Rate Perpetual Non-Cumulative Preferred Stock Series G,$27.66,-0.01,-0.036%,,United States,,23199,,
KEYS,Keysight Technologies Inc. Common Stock,$137.35,-0.13,-0.095%,25546335235.0,United States,2014.0,706739,Capital Goods,Industrial Machinery/Components
KF,Korea Fund Inc. (The) New Common Stock,$43.364,-0.3405,-0.779%,217686239.0,United States,,1435,,
KFS,Kingsway Financial Services Inc. Common Stock (DE),$4.43,-0.13,-2.851%,100610036.0,Canada,,11671,Finance,Property-Casualty Insurers
KFY,Korn Ferry Common Stock,$64.37,1.23,1.948%,3476415721.0,United States,1999.0,542084,Technology,Diversified Commercial Services
KGC,Kinross Gold Corporation Common Stock,$7.06,0.18,2.616%,8884304000.0,Canada,,20763277,Basic Industries,Precious Metals
KIM,Kimco Realty Corporation Common Stock,$19.38,0.28,1.466%,8380683712.0,United States,,4628641,Consumer Services,Real Estate Investment Trusts
KIM^L,Kimco Realty Corporation Class L Depositary Shares each of which represents a one-one thousandth fractional interest in a share of 5.125% Class L Cumulative Redeemable Preferred Stock liquidation preference $25000.00 per share,$26.26,0.07,0.267%,,United States,,13354,,
KIM^M,Kimco Realty Corporation Class M Depositary Shares each of which represents a one-one thousandth fractional interest in a share of 5.25% Class M Cumulative Redeemable Preferred Stock liquidation preference $25000.00 per share,$26.34,-0.06,-0.227%,,United States,,15038,,
KIO,KKR Income Opportunities Fund Common Shares,$15.68,-0.03,-0.191%,318936139.0,,2013.0,36613,,
KKR,KKR & Co. Inc. Common Stock,$48.98,0.05,0.102%,28242415303.0,United States,,1856914,Finance,Investment Managers
KKR^A,KKR & Co. Inc. 6.75% Series A Preferred Stock,$25.825,0.015,0.058%,,United States,,14561,,
KKR^B,KKR & Co. Inc. 6.50% Series B Preferred Stock,$25.72,0.06,0.234%,,United States,,10576,,
KKR^C,KKR & Co. Inc. 6.00% Series C Mandatory Convertible Preferred Stock,$67.50,-0.12,-0.177%,,United States,,65369,,
KL,Kirkland Lake Gold Ltd. Common Shares,$34.89,0.45,1.307%,9316459580.0,,,2268054,Basic Industries,Precious Metals
KMB,Kimberly-Clark Corporation Common Stock,$132.55,-1.88,-1.398%,44802790073.0,United States,,2188565,Consumer Durables,Containers/Packaging
KMF,Kayne Anderson NextGen Energy & Infrastructure Inc.,$6.68,0.06,0.906%,315279046.0,,2010.0,195378,,
