Symbol,Name,Last Sale,Net Change,% Change,Market Cap,Country,IPO Year,Volume,Sector,Industry
JAMF,Jamf Holding Corp. Common Stock,$38.55,-0.35,-0.90%,4528254278.0,United States,2020.0,512412,Technology,Computer Software: Prepackaged Software
JAN,JanOne Inc. Common Stock (NV),$8.80,0.35,4.142%,21132408.0,United States,,244693,Consumer Services,Home Furnishings
JAZZ,Jazz Pharmaceuticals plc Common Stock (Ireland),$173.15,1.26,0.733%,9752749243.0,Ireland,2007.0,421278,Health Care,Major Pharmaceuticals
JBHT,J.B. Hunt Transport Services Inc. Common Stock,$159.90,1.73,1.094%,16902230459.0,United States,,367966,Transportation,Trucking Freight/Courier Services
JBLU,JetBlue Airways Corporation Common Stock,$21.18,0.44,2.122%,6693492271.0,United States,2002.0,7037805,Transportation,Air Freight/Delivery Services
JBSS,John B. Sanfilippo & Son Inc. Common Stock,$89.62,-1.78,-1.947%,1027584085.0,United States,1991.0,47448,Consumer Non-Durables,Specialty Foods
JCIC,Jack Creek Investment Corp. Class A Ordinary Shares,$9.69,-0.31,-3.10%,0.0,United States,2021.0,10034,Finance,Business Services
JCICU,Jack Creek Investment Corp. Units,$10.0302,-0.0498,-0.494%,0.0,United States,2021.0,21299,Finance,Business Services
JCICW,Jack Creek Investment Corp. Warrants,$0.7999,-0.0401,-4.774%,0.0,United States,2021.0,67266,Finance,Business Services
JCOM,j2 Global Inc. Common Stock,$120.00,-1.89,-1.551%,5420465280.0,United States,1999.0,493051,Technology,Telecommunications Equipment
JCS,Communications Systems Inc. Common Stock,$6.90,0.0,0.00%,64360261.0,United States,,72374,Public Utilities,Telecommunications Equipment
JCTCF,Jewett-Cameron Trading Company Common Shares,$10.8789,0.1689,1.577%,37958234.0,United States,,2035,Consumer Services,RETAIL: Building Materials
JD,JD.com Inc. American Depositary Shares,$85.37,-0.39,-0.455%,132472854815.0,China,2014.0,11923562,Consumer Services,Other Specialty Stores
JFIN,Jiayin Group Inc. American Depositary Shares,$5.42,1.15,26.932%,292815500.0,China,2019.0,1990936,Finance,Finance: Consumer Services
JFU,9F Inc. American Depositary Shares,$2.05,0.04,1.99%,400141550.0,China,2019.0,1975482,Finance,Finance: Consumer Services
JG,Aurora Mobile Limited American Depositary Shares,$6.28,0.33,5.546%,726740610.0,China,2018.0,1868396,Technology,Computer Software: Programming Data Processing
JJSF,J & J Snack Foods Corp. Common Stock,$164.24,-0.26,-0.158%,3117215581.0,United States,1986.0,75468,Consumer Non-Durables,Specialty Foods
JKHY,Jack Henry & Associates Inc. Common Stock,$150.74,-0.33,-0.218%,11467887529.0,United States,1985.0,321123,Technology,EDP Services
JMPNL,JMP Group LLC 7.25% Senior Notes due 2027,$25.34,-0.01,-0.039%,0.0,United States,,2532,Finance,Investment Bankers/Brokers/Service
JMPNZ,JMP Group LLC 6.875% Senior Notes due 2029,$24.3986,0.0386,0.158%,0.0,United States,,4224,Finance,Investment Bankers/Brokers/Service
JNCE,Jounce Therapeutics Inc. Common Stock,$11.24,-0.01,-0.089%,574853626.0,United States,2017.0,456873,Health Care,Biotechnology: Biological Products (No Diagnostic Substances)
JOAN,JOANN Inc. Common Stock,$11.85,-0.16,-1.332%,478397891.0,United States,2021.0,206556,Consumer Services,Other Specialty Stores
JOBS,51job Inc. American Depositary Shares,$63.51,-0.74,-1.152%,4280608105.0,China,2004.0,57156,Technology,Diversified Commercial Services
JOFFU,JOFF Fintech Acquisition Corp. Unit,$10.165,0.015,0.148%,0.0,United States,2021.0,99978,Finance,Business Services
JOUT,Johnson Outdoors Inc. Class A Common Stock,$146.68,-1.35,-0.912%,1483253389.0,United States,,44554,Consumer Non-Durables,Recreational Products/Toys
JRJC,China Finance Online Co. Limited American Depositary Shares,$11.70,-0.43,-3.545%,28570932.0,China,2004.0,20039,Finance,Investment Bankers/Brokers/Service
JRSH,Jerash Holdings (US) Inc. Common Stock,$6.33,0.05,0.796%,71687250.0,United States,2018.0,8105,Consumer Non-Durables,Apparel
JRVR,James River Group Holdings Ltd. Common Shares,$47.52,-0.66,-1.37%,1461977035.0,Bermuda,2014.0,225171,Finance,Property-Casualty Insurers
JSM,Navient Corporation 6% Senior Notes due December 15 2043,$24.288,-0.042,-0.173%,0.0,United States,,25124,Finance,Finance: Consumer Services
JUPW,Jupiter Wellness Inc. Common Stock,$5.58,-0.11,-1.933%,51237418.0,United States,2020.0,134271,Consumer Non-Durables,Package Goods/Cosmetics
JUPWW,Jupiter Wellness Inc. Warrant,$0.9599,0.0399,4.337%,0.0,United States,2020.0,2158,Consumer Non-Durables,Package Goods/Cosmetics
JVA,Coffee Holding Co. Inc. Common Stock,$5.17,0.2,4.024%,29513457.0,United States,2005.0,174020,Consumer Non-Durables,Packaged Foods
JWEL,Jowell Global Ltd. Ordinary Shares,$8.71,1.71,24.429%,216562923.0,China,,1618654,,
JYAC,Jiya Acquisition Corp. Class A Common Stock,$10.01,-0.17,-1.67%,137407670.0,United States,2020.0,6090,Finance,Business Services
JYNT,The Joint Corp. Common Stock,$42.82,-0.27,-0.627%,605470133.0,United States,2014.0,131823,Miscellaneous,Multi-Sector Companies
KAIIU,Kismet Acquisition Two Corp. Unit,$9.97,-0.01,-0.10%,0.0,United States,2021.0,1248,Finance,Business Services
KAIR,Kairos Acquisition Corp. Class A Ordinary Shares,$9.73,0.03,0.309%,0.0,United States,2021.0,28154,Finance,Business Services
KAIRU,Kairos Acquisition Corp. Unit,$10.05,0.0,0.00%,0.0,United States,2021.0,9619,Finance,Business Services
KAIRW,Kairos Acquisition Corp. Warrant,$0.7299,0.0099,1.375%,0.0,United States,2021.0,30864,Finance,Business Services
KALA,Kala Pharmaceuticals Inc. Common Stock,$7.99,0.16,2.043%,447918321.0,United States,2017.0,2769848,Health Care,Major Pharmaceuticals
KALU,Kaiser Aluminum Corporation Common Stock,$119.43,2.01,1.712%,1888447344.0,United States,,100051,Capital Goods,Metal Fabrications
KALV,KalVista Pharmaceuticals Inc. Common Stock,$35.83,1.62,4.735%,870962484.0,United Kingdom,2015.0,357493,Health Care,Major Pharmaceuticals
KBAL,Kimball International Inc. Class B Common Stock,$14.15,0.17,1.216%,521879055.0,United States,,170529,Consumer Durables,Home Furnishings
KBNT,Kubient Inc. Common Stock,$7.90,-0.06,-0.754%,93031577.0,United States,2020.0,668764,Technology,EDP Services
KBNTW,Kubient Inc. Warrant,$3.61,0.0489,1.373%,0.0,United States,2020.0,12903,Technology,EDP Services
KBSF,KBS Fashion Group Limited Common Stock,$4.02,0.32,8.649%,10417022.0,China,2013.0,163445,Consumer Non-Durables,Apparel
KC,Kingsoft Cloud Holdings Limited American Depositary Shares,$47.43,-2.99,-5.93%,10340582641.0,China,2020.0,5929070,Technology,Computer Software: Prepackaged Software
KCAPL,KCAP Financial Inc. 6.125% Notes due 2022,$25.25,0.035,0.139%,0.0,United States,,651,,
KDMN,Kadmon Holdings Inc. Common Stock,$4.32,0.05,1.171%,742249202.0,United States,,3317082,Health Care,Major Pharmaceuticals
KDNY,Chinook Therapeutics Inc. Common Stock,$17.83,0.55,3.183%,751684843.0,United States,2015.0,73895,Health Care,Major Pharmaceuticals
KDP,Keurig Dr Pepper Inc. Common Stock,$34.10,0.015,0.044%,47987813975.0,United States,,7517944,Consumer Non-Durables,Beverages (Production/Distribution)
KE,Kimball Electronics Inc. Common Stock,$28.45,0.02,0.07%,710028385.0,United States,,295589,Technology,Electrical Products
KELYA,Kelly Services Inc. Class A Common Stock,$22.00,0.15,0.686%,864635222.0,United States,,258530,Technology,Professional Services
KELYB,Kelly Services Inc. Class B Common Stock,$21.60,0.1378,0.642%,848914582.0,United States,,790,Technology,Professional Services
KEQU,Kewaunee Scientific Corporation Common Stock,$12.12,-0.3,-2.415%,33485100.0,United States,,6285,Capital Goods,Medical Specialities
KERN,Akerna Corp. Common Stock,$5.54,0.31,5.927%,77885237.0,United States,2018.0,1369773,Technology,EDP Services
KERNW,Akerna Corp Warrant,$1.7301,0.1101,6.796%,0.0,United States,2018.0,5667,Technology,EDP Services
KFFB,Kentucky First Federal Bancorp Common Stock,$7.48,-0.34,-4.348%,61666728.0,United States,,5090,Finance,Savings Institutions
KFRC,Kforce Inc. Common Stock,$52.43,-0.09,-0.171%,1158022930.0,United States,1995.0,54011,Technology,Professional Services
KHC,The Kraft Heinz Company Common Stock,$39.08,0.34,0.878%,47801708193.0,United States,,6405890,Consumer Non-Durables,Packaged Foods
KIDS,OrthoPediatrics Corp. Common Stock,$47.93,2.36,5.179%,942223997.0,United States,2017.0,253615,Health Care,Medical/Dental Instruments
KIIIU,Kismet Acquisition Three Corp. Unit,$9.945,-0.035,-0.351%,0.0,United States,2021.0,54206,Finance,Business Services
KIN,Kindred Biosciences Inc. Common Stock,$5.00,0.06,1.215%,197460670.0,United States,2013.0,1687943,Health Care,Major Pharmaceuticals
KINS,Kingstone Companies Inc. Common Stock,$7.44,0.09,1.224%,79423473.0,United States,,15188,Finance,Property-Casualty Insurers
KINZ,KINS Technology Group Inc. Class A Common Stock,$9.85,0.02,0.203%,339825000.0,United States,2021.0,36941,Finance,Business Services
KINZU,KINS Technology Group Inc. Unit,$10.31,-0.01,-0.097%,0.0,United States,2020.0,8664,Finance,Business Services
KINZW,KINS Technology Group Inc. Warrant,$0.97,-0.03,-3.00%,0.0,United States,2021.0,26115,Finance,Business Services
KIRK,Kirkland's Inc. COMMONSTOCK,$29.25,0.56,1.952%,416976183.0,United States,2002.0,528166,Consumer Services,Other Specialty Stores
KLAC,KLA Corporation Common Stock,$305.39,3.44,1.139%,47052857669.0,United States,1980.0,1906301,Capital Goods,Electronic Components
KLAQ,KL Acquisition Corp Class A Common Stock,$9.83,0.05,0.511%,353265625.0,United States,2021.0,10150,Finance,Business Services
KLAQU,KL Acquisition Corp Unit,$10.05,0.05,0.50%,0.0,United States,2021.0,2992,Finance,Business Services
KLAQW,KL Acquisition Corp Warrant,$0.80,-0.001,-0.125%,0.0,United States,2021.0,10510,Finance,Business Services
KLDO,Kaleido Biosciences Inc. Common Stock,$10.43,0.06,0.579%,442928630.0,United States,2019.0,111673,Health Care,Biotechnology: Biological Products (No Diagnostic Substances)
KLIC,Kulicke and Soffa Industries Inc. Common Stock,$50.98,0.7,1.392%,3164684797.0,Singapore,,479734,Technology,Semiconductors
KLXE,KLX Energy Services Holdings Inc. Common Stock,$18.12,1.01,5.903%,154203338.0,United States,,86936,Energy,Oilfield Services/Equipment
KMDA,Kamada Ltd. Ordinary Shares,$6.27,-0.03,-0.476%,280553432.0,Israel,2013.0,85853,Health Care,Major Pharmaceuticals
KMPH,KemPharm Inc. Common Stock,$11.42,0.39,3.536%,324057586.0,United States,,4989505,Health Care,Major Pharmaceuticals
KNDI,Kandi Technologies Group Inc Common Stock,$7.07,0.22,3.212%,511709314.0,China,,4094090,Capital Goods,Auto Manufacturing
KNSA,Kiniksa Pharmaceuticals Ltd. Class A Common Stock,$22.46,-0.43,-1.879%,1532497548.0,United States,2018.0,711583,Health Care,Major Pharmaceuticals
KNSL,Kinsale Capital Group Inc. Common Stock,$175.25,1.5,0.863%,3990991734.0,United States,2016.0,91828,Finance,Property-Casualty Insurers
KNTE,Kinnate Biopharma Inc. Common Stock,$37.00,0.63,1.732%,1603107103.0,United States,2020.0,323320,Health Care,Major Pharmaceuticals
KOD,Kodiak Sciences Inc Common Stock,$134.41,5.33,4.129%,6876741410.0,United States,2018.0,213799,Health Care,Biotechnology: Biological Products (No Diagnostic Substances)
KOPN,Kopin Corporation Common Stock,$10.10,0.17,1.712%,918950207.0,United States,1992.0,3359073,Technology,Semiconductors
KOR,Corvus Gold Inc. Common Shares,$2.02,0.0,0.00%,255798347.0,Canada,,104869,Basic Industries,Precious Metals
KOSS,Koss Corporation Common Stock,$27.44,0.74,2.772%,230369035.0,United States,,3185791,Consumer Non-Durables,Consumer Electronics/Appliances
KPTI,Karyopharm Therapeutics Inc. Common Stock,$12.55,0.045,0.36%,936660352.0,United States,2013.0,1093627,Health Care,Major Pharmaceuticals
KRBP,Kiromic BioPharma Inc. Common Stock,$10.07,-0.3,-2.893%,73843300.0,United States,2020.0,12819,Health Care,Biotechnology: Biological Products (No Diagnostic Substances)
KRKR,36Kr Holdings Inc. American Depositary Shares,$4.01,0.03,0.754%,150352303.0,China,2019.0,70154,Miscellaneous,Business Services
KRMD,Repro Med Systems Inc. Common Stock,$3.91,0.01,0.256%,171816692.0,United States,,226477,Health Care,Medical/Dental Instruments
KRNLU,Kernel Group Holdings Inc. Units,$9.99,-0.01,-0.10%,0.0,United States,2021.0,51318,Finance,Business Services
KRNT,Kornit Digital Ltd. Ordinary Shares,$102.31,1.0,0.987%,4632384814.0,Israel,2015.0,130619,Capital Goods,Industrial Machinery/Components
KRNY,Kearny Financial Corp Common Stock,$12.77,0.0,0.00%,1075237333.0,United States,,431535,Finance,Savings Institutions
KRON,Kronos Bio Inc. Common Stock,$28.34,0.16,0.568%,1587989503.0,United States,2020.0,197188,Health Care,Major Pharmaceuticals
KROS,Keros Therapeutics Inc. Common Stock,$59.75,-0.81,-1.338%,1384906472.0,United States,2020.0,61036,Health Care,Major Pharmaceuticals
KRTX,Karuna Therapeutics Inc. Common Stock,$121.88,3.88,3.288%,3293043300.0,United States,2019.0,245148,Health Care,Major Pharmaceuticals
KRUS,Kura Sushi USA Inc. Class A Common Stock,$35.69,1.16,3.359%,298785473.0,United States,2019.0,34425,Consumer Services,Restaurants
KRYS,Krystal Biotech Inc. Common Stock,$81.97,-0.03,-0.037%,1819303821.0,United States,2017.0,95423,Health Care,Biotechnology: Biological Products (No Diagnostic Substances)
KSICU,Kadem Sustainable Impact Corporation Unit,$9.95,-0.05,-0.50%,0.0,United States,,7118830,,
KSMT,Kismet Acquisition One Corp Ordinary Shares,$9.90,0.0,0.00%,314325000.0,Russia,2020.0,104454,Finance,Business Services
KSMTU,Kismet Acquisition One Corp Unit,$10.12,-0.32,-3.065%,0.0,Russia,2020.0,4045,Finance,Business Services
KSMTW,Kismet Acquisition One Corp Warrant,$0.9109,0.0109,1.211%,0.0,Russia,,32484,Finance,Business Services
KSPN,Kaspien Holdings Inc. Common Stock,$28.50,-1.5,-5.00%,54896301.0,United States,,63071,Consumer Services,Consumer Electronics/Video Chains
KTCC,Key Tronic Corporation Common Stock,$8.40,-0.33,-3.78%,90381312.0,United States,1983.0,101442,Technology,Electrical Products
KTOS,Kratos Defense & Security Solutions Inc. Common Stock,$27.08,0.6,2.266%,3343380640.0,United States,,1413069,Capital Goods,Military/Government/Technical
KTRA,Kintara Therapeutics Inc. Common Stock,$2.11,-0.08,-3.653%,64620898.0,United States,,293348,Health Care,Major Pharmaceuticals
KURA,Kura Oncology Inc. Common Stock,$28.59,0.99,3.587%,1892978637.0,United States,,486459,Health Care,Major Pharmaceuticals
KURIU,Alkuri Global Acquisition Corp. Unit,$9.97,-0.01,-0.10%,0.0,United States,2021.0,138487,Finance,Business Services
KVHI,KVH Industries Inc. Common Stock,$12.84,0.04,0.313%,236639146.0,United States,1996.0,126499,Technology,Radio And Television Broadcasting And Communications Equipment
KVSA,Khosla Ventures Acquisition Co. Class A Common Stock,$10.26,-0.14,-1.346%,368334000.0,United States,2021.0,546590,Finance,Business Services
KXIN,Kaixin Auto Holdings Ordinary Share,$3.39,0.11,3.354%,220797985.0,China,2017.0,2180196,Consumer Durables,Automotive Aftermarket
KYMR,Kymera Therapeutics Inc. Common Stock,$57.43,-1.23,-2.097%,2573523584.0,United States,2020.0,577858,Health Care,Biotechnology: Biological Products (No Diagnostic Substances)
KZIA,Kazia Therapeutics Limited American Depositary Shares,$10.91,0.25,2.345%,138074516.0,Australia,,86249,Health Care,Major Pharmaceuticals
KZR,Kezar Life Sciences Inc. Common Stock,$6.29,-0.01,-0.159%,302337297.0,United States,2018.0,238003,Health Care,Major Pharmaceuticals
LABP,Landos Biopharma Inc. Common Stock,$14.62,0.22,1.528%,572565604.0,United States,2021.0,88318,Health Care,Major Pharmaceuticals
LACQ,Leisure Acquisition Corp. Common Stock,$13.89,-0.05,-0.359%,86455083.0,United States,2017.0,1457,Finance,Business Services
LACQW,Leisure Acquisition Corp. Warrant,$1.09,-0.0999,-8.396%,0.0,United States,2017.0,22856,Finance,Business Services
LAKE,Lakeland Industries Inc. Common Stock,$29.11,-0.15,-0.513%,233461618.0,United States,1986.0,186726,Health Care,Industrial Specialties
LAMR,Lamar Advertising Company Class A Common Stock,$99.35,-0.28,-0.281%,10025580475.0,United States,1996.0,427041,Consumer Services,Real Estate Investment Trusts
LANC,Lancaster Colony Corporation Common Stock,$183.40,-2.01,-1.084%,5052486600.0,United States,,58860,Consumer Non-Durables,Packaged Foods
LAND,Gladstone Land Corporation Common Stock,$18.96,0.0249,0.132%,507050446.0,United States,2013.0,238428,Consumer Services,Real Estate Investment Trusts
LANDM,Gladstone Land Corporation 5.00% Series D Cumulative Term Preferred Stock,$25.75,0.01,0.039%,620636955.0,United States,,659,Consumer Services,Real Estate Investment Trusts
LANDO,Gladstone Land Corporation 6.00% Series B Cumulative Redeemable Preferred Stock,$25.55,-0.09,-0.351%,0.0,United States,,29875,Consumer Services,Real Estate Investment Trusts
LARK,Landmark Bancorp Inc. Common Stock,$26.62,-0.1,-0.374%,126467308.0,United States,,11977,Finance,Major Banks
LASR,nLIGHT Inc. Common Stock,$34.61,0.28,0.816%,1465392799.0,United States,2018.0,377234,Technology,Semiconductors
LATN,Union Acquisition Corp. II Ordinary Shares,$10.00,-0.03,-0.299%,250000000.0,United States,2019.0,507011,Finance,Business Services
LATNU,Union Acquisition Corp. II Units containing one ordinary share and one redeemable warrant,$10.60,0.0999,0.951%,0.0,United States,2019.0,816,Finance,Business Services
LATNW,Union Acquisition Corp. II Warrant,$0.6051,-0.0449,-6.908%,0.0,United States,2019.0,141878,Finance,Business Services
LAUR,Laureate Education Inc. Class A Common Stock,$14.18,-0.01,-0.07%,2821256770.0,United States,2017.0,543970,Consumer Services,Other Consumer Services
LAWS,Lawson Products Inc. Common Stock,$56.98,0.55,0.975%,516298002.0,United States,,8350,Consumer Durables,Industrial Specialties
LAZR,Luminar Technologies Inc.  Class A Common Stock,$27.46,-0.45,-1.612%,8895289150.0,United States,2019.0,6286369,Capital Goods,Auto Parts:O.E.M.
LAZY,Lazydays Holdings Inc. Common Stock,$21.43,-0.57,-2.591%,202553167.0,United States,,140758,Consumer Durables,Automotive Aftermarket
LBAI,Lakeland Bancorp Inc. Common Stock,$17.82,0.05,0.281%,899928159.0,United States,,97834,Finance,Major Banks
LBC,Luther Burbank Corporation Common Stock,$11.57,0.0,0.00%,604291127.0,United States,2017.0,20813,Finance,Major Banks
LBPH,Longboard Pharmaceuticals Inc. Common Stock,$16.00,-0.5,-3.03%,270671840.0,United States,2021.0,39804,Health Care,Major Pharmaceuticals
LBRDA,Liberty Broadband Corporation Class A Common Stock,$151.16,-0.61,-0.402%,29524385424.0,United States,,92632,Consumer Services,Television Services
LBRDK,Liberty Broadband Corporation Class C Common Stock,$156.16,0.09,0.058%,30500979279.0,United States,,1311799,Consumer Services,Television Services
LBRDP,Liberty Broadband Corporation Series A Cumulative Redeemable Preferred Stock,$27.205,-0.045,-0.165%,0.0,United States,,5112,Public Utilities,Telecommunications Equipment
LBTYA,Liberty Global plc Class A Ordinary Shares,$26.755,0.325,1.23%,15448671919.0,United Kingdom,,1402874,,
LBTYB,Liberty Global plc Class B Ordinary Shares,$26.65,0.415,1.582%,15388043605.0,United Kingdom,,706,Consumer Services,Television Services
LBTYK,Liberty Global plc Class C Ordinary Shares,$26.295,0.175,0.67%,15183062161.0,United Kingdom,,2758948,,
LCAAU,L Catterton Asia Acquisition Corp Units,$9.99,-0.01,-0.10%,0.0,Singapore,2021.0,25229,Finance,Business Services
LCAP,Lionheart Acquisition Corp. II Class A Common Stock,$9.88,0.09,0.919%,290472000.0,United States,2020.0,13883,Finance,Business Services
LCAPU,Lionheart Acquisition Corp. II Unit,$10.30,0.14,1.378%,0.0,United States,2020.0,3772,Finance,Business Services
LCAPW,Lionheart Acquisition Corp. II Warrant,$0.8199,-0.0301,-3.541%,0.0,United States,2020.0,44052,Finance,Business Services
LCNB,LCNB Corporation Common Stock,$18.31,0.08,0.439%,234642412.0,United States,,35829,Finance,Major Banks
LCUT,Lifetime Brands Inc. Common Stock,$15.54,0.45,2.982%,338331907.0,United States,1991.0,68874,Capital Goods,Industrial Machinery/Components
LCY,Landcadia Holdings III Inc. Class A Common Stock,$10.55,0.28,2.726%,648825000.0,United States,2020.0,1928218,Technology,Computer Software: Prepackaged Software
LCYAU,Landcadia Holdings III Inc. Unit ,$11.02,0.25,2.321%,0.0,United States,2020.0,117623,Capital Goods,Industrial Machinery/Components
LCYAW,Landcadia Holdings III Inc. Warrant,$1.66,0.06,3.75%,0.0,United States,2020.0,217288,Capital Goods,Industrial Machinery/Components
LE,Lands' End Inc. Common Stock,$38.62,3.42,9.716%,1259311575.0,United States,,653813,Consumer Services,Clothing/Shoe/Accessory Stores
LECO,Lincoln Electric Holdings Inc. Common Shares,$125.96,1.23,0.986%,7515030055.0,United States,,231652,Technology,Industrial Machinery/Components
LEDS,SemiLEDS Corporation Common Stock,$5.17,0.09,1.772%,20738540.0,Taiwan,2010.0,41841,Technology,Semiconductors
LEGH,Legacy Housing Corporation Common Stock (TX),$16.72,0.31,1.889%,404492865.0,United States,2018.0,93520,Basic Industries,Homebuilding
LEGN,Legend Biotech Corporation American Depositary Shares,$28.31,1.75,6.589%,3658856675.0,United States,2020.0,665693,Health Care,Major Pharmaceuticals
LEGO,Legato Merger Corp. Common stock,$9.71,-0.03,-0.308%,258558230.0,United States,2021.0,19731,Finance,Business Services
LEGOU,Legato Merger Corp. Units,$10.27,-0.03,-0.291%,0.0,United States,2021.0,13033,Finance,Business Services
LEGOW,Legato Merger Corp. Warrant,$0.57,-0.03,-5.00%,0.0,United States,2021.0,593321,Finance,Business Services
LESL,Leslie's Inc. Common Stock,$23.05,0.12,0.523%,4307430510.0,United States,2020.0,1320459,Consumer Services,Other Specialty Stores
LEVL,Level One Bancorp Inc. Common Stock,$23.25,-0.5,-2.105%,177252513.0,United States,2018.0,11522,Finance,Major Banks
LEVLP,Level One Bancorp Inc. Depositary Shares Each Representing a 1/100th Interest in a Share of 7.50% Non-Cumulative Perpetual Preferred Stock Series B,$27.40,0.4,1.481%,0.0,United States,,890,Finance,Major Banks
LEXX,Lexaria Bioscience Corp. Common Stock,$7.00,0.12,1.744%,35730324.0,Canada,,170499,Health Care,Major Pharmaceuticals
LEXXW,Lexaria Bioscience Corp. Warrant,$2.45,0.05,2.083%,0.0,Canada,,16769,Health Care,Major Pharmaceuticals
LFMD,LifeMD Inc. Common Stock,$20.08,0.06,0.30%,513628388.0,United States,,591152,Health Care,Medical/Nursing Services
LFTR,Lefteris Acquisition Corp. Class A Common Stock,$10.08,0.0,0.00%,260944669.0,United States,2020.0,176276,Finance,Business Services
LFTRU,Lefteris Acquisition Corp. Unit,$10.7499,0.0899,0.843%,0.0,United States,2020.0,6950,Finance,Business Services
LFTRW,Lefteris Acquisition Corp. Warrant,$1.735,0.085,5.152%,0.0,United States,2020.0,46277,Finance,Business Services
LFUS,Littelfuse Inc. Common Stock,$274.59,0.33,0.12%,6740826709.0,United States,,112932,Consumer Durables,Electrical Products
LFVN,Lifevantage Corporation Common Stock (Delaware),$9.45,-0.02,-0.211%,133874219.0,United States,,104206,Health Care,Major Pharmaceuticals
LGACU,Lazard Growth Acquisition Corp. I Units,$10.04,0.01,0.10%,0.0,,2021.0,57360,Finance,Business Services
LGHL,Lion Group Holding Ltd. American Depositary Share,$4.06,0.54,15.341%,79050835.0,China,,12103353,Finance,Investment Bankers/Brokers/Service
LGHLW,Lion Group Holding Ltd. Warrant,$0.5611,0.026000000000000002,4.859%,0.0,China,,389192,Finance,Investment Bankers/Brokers/Service
LGIH,LGI Homes Inc. Common Stock,$144.82,7.22,5.247%,3618119304.0,United States,2013.0,326570,Capital Goods,Homebuilding
LGND,Ligand Pharmaceuticals Incorporated Common Stock,$165.98,3.46,2.129%,2757329804.0,United States,,146021,Health Care,Major Pharmaceuticals
LGVN,Longeveron Inc. Class A Common Stock,$7.58,0.2,2.71%,141798385.0,United States,2021.0,433016,Health Care,Major Pharmaceuticals
LHAA,Lerer Hippeau Acquisition Corp. Class A Common Stock,$9.97,0.02,0.201%,278837909.0,United States,2021.0,265650,Finance,Business Services
LHCG,LHC Group Common Stock,$200.22,6.08,3.132%,6325817353.0,United States,2005.0,218459,Health Care,Medical/Nursing Services
LHDX,Lucira Health Inc. Common Stock,$15.20,-0.41,-2.627%,582354074.0,United States,2021.0,295307,Health Care,Biotechnology: In Vitro & In Vivo Diagnostic Substances
LI,Li Auto Inc. American Depositary Shares,$25.43,-0.41,-1.587%,23005100862.0,China,2020.0,12871619,Capital Goods,Auto Manufacturing
LIFE,aTyr Pharma Inc. Common Stock,$5.61,-0.53,-8.632%,57140419.0,United States,2015.0,5831862,Health Care,Biotechnology: Biological Products (No Diagnostic Substances)
LILA,Liberty Latin America Ltd. Class A Common Stock,$14.49,0.49,3.50%,3362729105.0,United States,,222610,Consumer Services,Television Services
LILAK,Liberty Latin America Ltd. Class C Common Stock,$14.54,0.44,3.121%,3374332725.0,United States,,680770,Consumer Services,Television Services
LINC,Lincoln Educational Services Corporation Common Stock,$6.53,0.03,0.462%,176237941.0,United States,2005.0,202253,Consumer Services,Other Consumer Services
LIND,Lindblad Expeditions Holdings Inc. Common Stock,$18.58,0.06,0.324%,928790603.0,United States,2013.0,282213,Consumer Services,Transportation Services
LIQT,LiqTech International Inc. Common Stock,$10.01,-0.09,-0.891%,216771165.0,Denmark,,26140,Technology,Industrial Machinery/Components
LITE,Lumentum Holdings Inc. Common Stock,$88.41,-1.76,-1.952%,6692637000.0,United States,,1642930,Capital Goods,Telecommunications Equipment
LIVE,Live Ventures Incorporated Common Stock,$25.88,-0.42,-1.597%,40247929.0,United States,,40037,Consumer Services,Other Specialty Stores
LIVK,LIV Capital Acquisition Corp. Class A Ordinary Shares,$9.95,-0.05,-0.50%,100818375.0,Mexico,2020.0,4000,Finance,Business Services
LIVKU,LIV Capital Acquisition Corp. Unit,$10.78,-0.72,-6.261%,0.0,Mexico,2019.0,100,Finance,Business Services
LIVKW,LIV Capital Acquisition Corp. Warrant,$0.8001,-0.0799,-9.08%,0.0,Mexico,2020.0,9750,Finance,Business Services
LIVN,LivaNova PLC Ordinary Shares,$77.98,-0.35,-0.447%,3794774193.0,United Kingdom,,229576,Health Care,Biotechnology: Electromedical & Electrotherapeutic Apparatus
LIVX,LiveXLive Media Inc. Common Stock,$4.53,0.42,10.219%,341917954.0,United States,,1393405,Consumer Services,Restaurants
LIXT,Lixte Biotechnology Holdings Inc. Common Stock,$3.76,0.03,0.804%,50787839.0,United States,,211369,Health Care,Major Pharmaceuticals
