Symbol,Name,Last Sale,Net Change,% Change,Market Cap,Country,IPO Year,Volume,Sector,Industry
USCR,U.S. Concrete Inc. Common Stock,$63.94,1.37,2.19%,1072217916.0,United States,,179967,Capital Goods,Building Materials
USEG,U.S. Energy Corp. Common Stock,$4.91,0.11,2.292%,21871870.0,United States,,191536,Energy,Oil & Gas Production
USIO,Usio Inc. Common Stock,$5.65,0.15,2.727%,141108722.0,United States,,420367,Finance,Investment Bankers/Brokers/Service
USLM,United States Lime & Minerals Inc. Common Stock,$143.45,0.24,0.168%,810971049.0,United States,,7158,Basic Industries,Mining & Quarrying of Nonmetallic Minerals (No Fuels)
USWS,U.S. Well Services Inc. Class A Common Stock,$1.35,-0.02,-1.46%,115960910.0,United States,2017.0,1361126,Energy,Oilfield Services/Equipment
USWSW,U.S. Well Services Inc. Warrants,$0.24,0.031,14.833%,0.0,United States,2017.0,184399,Energy,Oilfield Services/Equipment
UTHR,United Therapeutics Corporation Common Stock,$171.17,4.6,2.762%,7624653822.0,United States,1999.0,486388,Health Care,Major Pharmaceuticals
UTMD,Utah Medical Products Inc. Common Stock,$90.63,-1.27,-1.382%,330168262.0,United States,,7731,Health Care,Medical/Dental Instruments
UTSI,UTStarcom Holdings Corp.,$1.74,0.15,9.434%,62510723.0,China,2000.0,459071,Capital Goods,Telecommunications Equipment
UVSP,Univest Financial Corporation Common Stock,$27.85,0.06,0.216%,816493768.0,United States,,67646,Finance,Major Banks
UXIN,Uxin Limited ADS,$1.18,0.0,0.00%,402883767.0,China,2018.0,1239609,Miscellaneous,Business Services
VACQ,Vector Acquisition Corporation Class A Common Stock,$11.99,0.12,1.011%,479600000.0,United States,2020.0,1234426,Finance,Business Services
VACQU,Vector Acquisition Corporation Unit,$13.04,0.02,0.154%,0.0,United States,2020.0,17128,Finance,Business Services
VACQW,Vector Acquisition Corporation Warrant,$3.19,-0.12,-3.625%,0.0,United States,2020.0,458582,Finance,Business Services
VALU,Value Line Inc. Common Stock,$30.00,-1.6,-5.063%,287225610.0,United States,1983.0,9279,Finance,Investment Managers
VAQC,Vector Acquisition Corporation II Class A Ordinary Shares,$10.01,0.02,0.20%,590965375.0,United States,2021.0,331710,Finance,Business Services
VBFC,Village Bank and Trust Financial Corp. Common Stock,$40.6546,0.0,0.00%,59620621.0,United States,,73,Finance,Major Banks
VBIV,VBI Vaccines Inc. New Common Stock (Canada),$3.54,0.02,0.568%,899175983.0,United States,,3735968,Health Care,Major Pharmaceuticals
VBLT,Vascular Biogenics Ltd. Ordinary Shares,$2.08,0.02,0.971%,100229923.0,Israel,2014.0,220975,Health Care,Major Pharmaceuticals
VBTX,Veritex Holdings Inc. Common Stock,$32.78,0.13,0.398%,1620114557.0,United States,2014.0,274667,Finance,Major Banks
VC,Visteon Corporation Common Stock,$135.00,4.28,3.274%,3768614235.0,United States,,184561,Capital Goods,Auto Parts:O.E.M.
VCEL,Vericel Corporation Common Stock,$46.78,1.36,2.994%,2149774526.0,United States,,492677,Health Care,Biotechnology: Biological Products (No Diagnostic Substances)
VCKA,Vickers Vantage Corp. I Ordinary Shares,$9.95,0.04,0.404%,0.0,Singapore,2021.0,11029,Finance,Business Services
VCKAU,Vickers Vantage Corp. I Unit,$10.1745,0.0145,0.143%,0.0,Singapore,2021.0,21366,Finance,Business Services
VCKAW,Vickers Vantage Corp. I Warrant,$0.56,-0.0001,-0.018%,0.0,Singapore,2021.0,73886,Finance,Business Services
VCNX,Vaccinex Inc. Common Stock,$3.59,-0.05,-1.374%,80364405.0,United States,2018.0,809267,Health Care,Major Pharmaceuticals
VCTR,Victory Capital Holdings Inc. Class A Common Stock,$26.91,0.27,1.014%,1817551614.0,United States,2018.0,51534,Finance,Investment Managers
VCVC,10X Capital Venture Acquisition Corp Class A Common Stock,$10.72,-0.48,-4.286%,269675000.0,United States,2021.0,457050,Capital Goods,Auto Parts:O.E.M.
VCVCU,10X Capital Venture Acquisition Corp Unit,$11.73,-0.96,-7.565%,0.0,United States,2020.0,6023,Capital Goods,Auto Parts:O.E.M.
VCVCW,10X Capital Venture Acquisition Corp Warrant,$2.26,-0.02,-0.877%,0.0,United States,2021.0,77860,Capital Goods,Auto Parts:O.E.M.
VCYT,Veracyte Inc. Common Stock,$53.92,1.01,1.909%,3612720664.0,United States,2013.0,1355968,Health Care,Medical Specialities
VECO,Veeco Instruments Inc. Common Stock,$21.71,0.12,0.556%,1079510254.0,United States,1994.0,417122,Technology,Industrial Machinery/Components
VELOU,Velocity Acquisition Corp. Units,$9.99,0.05,0.503%,0.0,United States,2021.0,8713,Finance,Business Services
VENAU,Venus Acquisition Corporation Units,$10.15,0.035,0.346%,0.0,United States,2021.0,44205,Finance,Business Services
VEON,VEON Ltd. ADS,$1.83,-0.01,-0.543%,3200903149.0,Netherlands,,3411440,Public Utilities,Telecommunications Equipment
VERB,Verb Technology Company Inc. Common Stock,$1.71,-0.01,-0.581%,87269409.0,United States,,2804170,Consumer Services,Other Consumer Services
VERBW,Verb Technology Company Inc. Warrant,$0.6601,-0.0399,-5.70%,0.0,United States,,7108,Consumer Services,Other Consumer Services
VERI,Veritone Inc. Common Stock,$30.15,0.265,0.887%,973815091.0,United States,2017.0,766106,Technology,EDP Services
VERO,Venus Concept Inc. Common Stock,$2.77,0.19,7.364%,148336619.0,United States,2017.0,625327,Health Care,Medical/Dental Instruments
VERU,Veru Inc. Common Stock,$14.91,0.08,0.539%,1168400024.0,United States,,922443,Health Care,Major Pharmaceuticals
VERX,Vertex Inc. Class A Common Stock,$25.67,0.19,0.746%,3759217480.0,United States,2020.0,331776,Technology,Computer Software: Prepackaged Software
VERY,Vericity Inc. Common Stock,$10.98,-0.32,-2.832%,163327500.0,United States,2019.0,1087,Finance,Life Insurance
VFF,Village Farms International Inc. Common Shares,$15.51,-0.07,-0.449%,1206971263.0,Canada,,2866687,Consumer Non-Durables,Farming/Seeds/Milling
VG,Vonage Holdings Corp. Common Stock,$12.41,0.18,1.472%,3091728989.0,United States,2006.0,3118475,Public Utilities,Telecommunications Equipment
VIAC,ViacomCBS Inc. Class B Common Stock,$92.34,-3.9,-4.052%,57214430321.0,United States,,34628305,Consumer Services,Broadcasting
VIACA,ViacomCBS Inc. Class A Common Stock,$92.01,-4.12,-4.286%,57009960297.0,United States,,377276,Consumer Services,Broadcasting
VIAV,Viavi Solutions Inc. Common Stock,$16.55,-0.02,-0.121%,3785481119.0,United States,,1421706,Technology,Semiconductors
VICR,Vicor Corporation Common Stock,$94.44,0.07,0.074%,4100241133.0,United States,,94138,Capital Goods,Industrial Machinery/Components
VIEW,View Inc. Class A Common Stock,$8.75,-0.2,-2.235%,1899421239.0,United States,2020.0,418328,Consumer Durables,Electronic Components
VIEWW,View Inc. Warrant,$1.94,-0.01,-0.513%,0.0,United States,2020.0,153525,Consumer Durables,Electronic Components
VIH,VPC Impact Acquisition Holdings Class A Ordinary Shares,$15.07,0.41,2.797%,390637035.0,United States,2020.0,294863,Technology,Computer Software: Prepackaged Software
VIHAU,VPC Impact Acquisition Holdings Unit,$16.94,0.59,3.609%,0.0,United States,2020.0,2646,Technology,Computer Software: Prepackaged Software
VIHAW,VPC Impact Acquisition Holdings Warrant,$3.96,-0.01,-0.252%,0.0,United States,2020.0,73209,Technology,Computer Software: Prepackaged Software
VII,7GC & Co. Holdings Inc. Class A common stock,$9.85,-0.01,-0.101%,283187500.0,United States,2021.0,79725,Finance,Business Services
VIIAU,7GC & Co. Holdings Inc. Unit,$10.24,-0.11,-1.063%,0.0,United States,2020.0,63273,Finance,Business Services
VIIAW,7GC & Co. Holdings Inc. Warrant,$0.89,-0.0588,-6.197%,0.0,United States,2021.0,58627,Finance,Business Services
VINC,Vincerx Pharma Inc. Common Stock,$25.36,-0.54,-2.085%,354645424.0,United States,2020.0,182924,Health Care,Major Pharmaceuticals
VINCU,Vincerx Pharma Inc. Unit ,$30.00,2.54,9.25%,0.0,United States,2020.0,800,Health Care,Major Pharmaceuticals
VINCW,Vincerx Pharma Inc. Warrant,$6.87,0.44,6.843%,0.0,United States,2020.0,29595,Health Care,Major Pharmaceuticals
VINO,Gaucho Group Holdings Inc. Common Stock,$5.50,0.75,15.789%,41113138.0,United States,,346620,Consumer Services,Homebuilding
VINP,Vinci Partners Investments Ltd. Class A Common Shares,$15.59,0.47,3.108%,865487799.0,Brazil,2021.0,161495,Finance,Investment Managers
VIOT,Viomi Technology Co. Ltd American Depositary Shares,$13.56,-0.82,-5.702%,942193982.0,China,2018.0,1449799,Consumer Durables,Consumer Electronics/Appliances
VIR,Vir Biotechnology Inc. Common Stock,$57.33,4.33,8.17%,7328884661.0,United States,2019.0,1076547,Health Care,Biotechnology: Biological Products (No Diagnostic Substances)
VIRC,Virco Manufacturing Corporation Common Stock,$3.64,-0.11,-2.933%,57943857.0,United States,,53849,Consumer Durables,Industrial Specialties
VIRI,Virios Therapeutics Inc. Common Stock,$6.16,-0.2,-3.145%,51020163.0,United States,2020.0,53414,Health Care,Major Pharmaceuticals
VIRT,Virtu Financial Inc. Class A Common Stock,$30.14,-0.08,-0.265%,5799331377.0,United States,2015.0,1580558,Finance,Investment Bankers/Brokers/Service
VIRX,Viracta Therapeutics Inc. Common Stock,$8.70,-0.26,-2.902%,321853220.0,United States,,269901,Health Care,Major Pharmaceuticals
VISL,Vislink Technologies Inc. Common Stock,$3.61,0.13,3.736%,164764187.0,United States,2013.0,4685077,Capital Goods,Telecommunications Equipment
VITL,Vital Farms Inc. Common Stock,$28.68,0.46,1.63%,1130914377.0,United States,2020.0,369575,Consumer Non-Durables,Packaged Foods
VIVE,Viveve Medical Inc. Common Stock,$3.75,0.24,6.838%,29392785.0,United States,,1117728,Health Care,Biotechnology: Electromedical & Electrotherapeutic Apparatus
VIVO,Meridian Bioscience Inc. Common Stock,$25.04,0.64,2.623%,1080351176.0,United States,1986.0,925075,Health Care,Biotechnology: In Vitro & In Vivo Diagnostic Substances
VJET,voxeljet AG American Depositary Shares,$17.26,1.33,8.349%,101844080.0,Germany,,71449,Capital Goods,Industrial Machinery/Components
VKTX,Viking Therapeutics Inc. Common Stock,$6.56,-0.035,-0.531%,486313274.0,United States,2015.0,776867,Health Care,Major Pharmaceuticals
VKTXW,Viking Therapeutics Inc. Warrants,$4.89,-0.223,-4.361%,0.0,United States,,4000,Health Care,Major Pharmaceuticals
VLDR,Velodyne Lidar Inc. Common Stock,$14.01,-0.22,-1.546%,2523142410.0,United States,,5353683,Capital Goods,Industrial Machinery/Components
VLDRW,Velodyne Lidar Inc. Warrants ,$4.58,-0.16,-3.376%,0.0,United States,,89503,Capital Goods,Industrial Machinery/Components
VLGEA,Village Super Market Inc. Class A Common Stock,$24.66,-0.58,-2.298%,358872936.0,United States,,28161,Consumer Services,Food Chains
VLON,Vallon Pharmaceuticals Inc. Common Stock,$5.43,-0.02,-0.367%,36984392.0,United States,2021.0,52797,Health Care,Major Pharmaceuticals
VLY,Valley National Bancorp Common Stock,$14.00,0.01,0.071%,5678566054.0,United States,,3902971,Finance,Major Banks
VLYPO,Valley National Bancorp 5.50% Fixed-to-Floating Rate Non-Cumulative Perpetual Preferred Stock Series B,$25.54,-0.18,-0.70%,0.0,United States,,1597,Finance,Major Banks
VLYPP,Valley National Bancorp 6.25% Fixed-to-Floating Rate Non-Cumulative Perpetual Preferred Stock Series A,$27.5841,-0.1259,-0.454%,0.0,United States,,2358,Finance,Major Banks
VMAC,Vistas Media Acquisition Company Inc. Class A Common Stock,$9.95,-0.03,-0.301%,152533500.0,United States,2020.0,228209,Finance,Business Services
VMACU,Vistas Media Acquisition Company Inc. Unit,$10.4705,-0.0495,-0.471%,0.0,United States,2020.0,1540,Finance,Business Services
VMACW,Vistas Media Acquisition Company Inc. Warrant,$0.679,-0.0321,-4.514%,0.0,United States,2020.0,136133,Finance,Business Services
VMAR,Vision Marine Technologies Inc. Common Shares,$9.56,-0.39,-3.92%,76579099.0,Canada,2020.0,77639,Capital Goods,Marine Transportation
VMD,Viemed Healthcare Inc. Common Shares,$9.30,-0.31,-3.226%,367921969.0,United States,,432137,Health Care,Misc Health and Biotechnology Services
VNDA,Vanda Pharmaceuticals Inc. Common Stock,$17.52,0.0,0.00%,961545079.0,United States,2006.0,485498,Health Care,Major Pharmaceuticals
VNET,21Vianet Group Inc. American Depositary Shares,$34.07,0.23,0.68%,4528683612.0,China,2011.0,1154129,Technology,Computer Software: Programming Data Processing
VNOM,Viper Energy Partners LP Common Unit,$17.62,0.38,2.204%,2748786498.0,United States,2014.0,421085,Energy,Oil & Gas Production
VOD,Vodafone Group Plc American Depositary Shares,$19.44,0.46,2.424%,54944070401.0,United Kingdom,,6464213,Public Utilities,Telecommunications Equipment
VOR,Vor Biopharma Inc. Common Stock,$37.97,-1.89,-4.742%,1409448261.0,United States,2021.0,295896,Health Care,Biotechnology: Biological Products (No Diagnostic Substances)
VOSO,Virtuoso Acquisition Corp. Class A Common Stock,$9.75,-0.005,-0.051%,0.0,United States,2021.0,591,Finance,Business Services
VOSOU,Virtuoso Acquisition Corp. Unit,$9.99,-0.01,-0.10%,0.0,United States,2021.0,31854,Finance,Business Services
VOSOW,Virtuoso Acquisition Corp. Warrant,$0.70,0.0001,0.014%,0.0,United States,2021.0,31015,Finance,Business Services
VOXX,VOXX International Corporation Class A Common Stock,$22.74,-0.2,-0.872%,544121128.0,United States,,358849,Technology,Electronic Components
VPCBU,VPC Impact Acquisition Holdings II Unit,$10.00,-0.015,-0.15%,0.0,United States,2021.0,1479,Finance,Business Services
VRA,Vera Bradley Inc. Common Stock,$11.75,0.13,1.119%,392620258.0,United States,2010.0,312399,Consumer Non-Durables,Apparel
VRAY,ViewRay Inc. Common Stock,$4.51,-0.03,-0.661%,725213872.0,United States,,1467167,Health Care,Biotechnology: Electromedical & Electrotherapeutic Apparatus
VRCA,Verrica Pharmaceuticals Inc. Common Stock,$17.28,0.62,3.721%,446956566.0,United States,2018.0,59482,Health Care,Major Pharmaceuticals
VRDN,Viridian Therapeutics Inc. Common Stock,$18.29,0.385,2.15%,71480210.0,United States,2014.0,13237,Health Care,Medical Specialities
VREX,Varex Imaging Corporation Common Stock,$23.27,0.05,0.215%,912184000.0,United States,,265946,Capital Goods,Industrial Machinery/Components
VRM,Vroom Inc. Common Stock,$37.23,0.02,0.054%,5048376235.0,United States,2020.0,4023368,Consumer Durables,Automotive Aftermarket
VRME,VerifyMe Inc. Common Stock,$4.83,0.09,1.899%,35002416.0,United States,,276618,Basic Industries,Major Chemicals
VRMEW,VerifyMe Inc. Warrant,$1.6164,-0.2336,-12.627%,0.0,United States,,3615,Basic Industries,Major Chemicals
VRNA,Verona Pharma plc American Depositary Share,$8.51,-0.09,-1.047%,492840098.0,United Kingdom,2017.0,112661,Health Care,Major Pharmaceuticals
VRNS,Varonis Systems Inc. Common Stock,$56.16,-0.56,-0.987%,5751982567.0,United States,2014.0,1147805,Technology,Computer Software: Prepackaged Software
VRNT,Verint Systems Inc. Common Stock,$48.97,0.16,0.328%,3403415000.0,United States,2002.0,698504,Technology,EDP Services
VRPX,Virpax Pharmaceuticals Inc. Common Stock,$5.4997,-0.1103,-1.966%,27196858.0,United States,2021.0,106103,Health Care,Major Pharmaceuticals
VRRM,Verra Mobility Corporation Class A Common Stock,$14.18,-0.48,-3.274%,2300972506.0,United States,2017.0,698751,Consumer Services,Transportation Services
VRSK,Verisk Analytics Inc. Common Stock,$171.94,-1.03,-0.595%,27990384781.0,United States,2009.0,798220,Technology,EDP Services
VRSN,VeriSign Inc. Common Stock,$190.74,-0.39,-0.204%,21571656565.0,United States,1998.0,1227884,Technology,EDP Services
VRTS,Virtus Investment Partners Inc. Common Stock,$261.09,3.67,1.426%,1979990897.0,United States,,30312,Finance,Investment Managers
VRTX,Vertex Pharmaceuticals Incorporated Common Stock,$217.08,-1.91,-0.872%,56432130259.0,United States,1991.0,1195409,Health Care,Major Pharmaceuticals
VS,Versus Systems Inc. Common Shares,$8.60,-0.2,-2.273%,105419325.0,Canada,,17211,Technology,EDP Services
VSAT,ViaSat Inc. Common Stock,$55.32,1.56,2.902%,3789714745.0,United States,1996.0,364845,Technology,Radio And Television Broadcasting And Communications Equipment
VSEC,VSE Corporation Common Stock,$42.27,0.73,1.757%,535570791.0,United States,,52319,Consumer Services,Military/Government/Technical
VSPR,Vesper Healthcare Acquisition Corp. Class A Common Stock,$11.22,0.15,1.355%,645150000.0,United States,2020.0,226110,Consumer Durables,Specialty Chemicals
VSPRU,Vesper Healthcare Acquisition Corp. Unit,$11.965,0.065,0.546%,0.0,United States,2020.0,1105,Consumer Durables,Specialty Chemicals
VSPRW,Vesper Healthcare Acquisition Corp. Warrant,$2.40,0.0,0.00%,0.0,United States,2020.0,4732,Consumer Durables,Specialty Chemicals
VSSYW,Versus Systems Inc. Class A Warrants,$4.00,0.2,5.263%,0.0,Canada,,6955,Technology,EDP Services
VSTA,Vasta Platform Limited Class A Ordinary Shares,$12.08,0.17,1.427%,1002779947.0,Brazil,2020.0,14103,Consumer Services,Other Consumer Services
VSTM,Verastem Inc. Common Stock,$2.38,0.12,5.31%,404063148.0,United States,2012.0,1590691,Health Care,Major Pharmaceuticals
VTAQ,Ventoux CCM Acquisition Corp. Common Stock,$9.89,0.08,0.815%,0.0,United States,2021.0,36247,Finance,Business Services
VTAQR,Ventoux CCM Acquisition Corp. Right,$0.2341,-0.0247,-9.544%,0.0,United States,2021.0,187040,Finance,Business Services
VTAQU,Ventoux CCM Acquisition Corp. Unit,$10.50,0.11,1.059%,0.0,United States,2020.0,30441,Finance,Business Services
VTAQW,Ventoux CCM Acquisition Corp. Warrant,$0.4799,0.0409,9.317%,0.0,United States,2021.0,59956,Finance,Business Services
VTGN,VistaGen Therapeutics Inc. Common Stock,$2.30,0.02,0.877%,325897150.0,United States,,2138583,Health Care,Major Pharmaceuticals
VTIQ,VectoIQ Acquisition Corp. II Class A Common Stock,$10.11,-0.15,-1.462%,0.0,United States,2021.0,69229,Finance,Business Services
VTIQU,VectoIQ Acquisition Corp. II Unit,$10.58,0.02,0.189%,0.0,United States,2021.0,27977,Finance,Business Services
VTIQW,VectoIQ Acquisition Corp. II Warrant,$1.90,0.02,1.064%,0.0,United States,2021.0,16737,Finance,Business Services
VTNR,Vertex Energy Inc Common Stock,$1.59,0.04,2.581%,79323426.0,United States,,649636,Energy,Integrated oil Companies
VTRS,Viatris Inc. Common Stock,$15.08,0.55,3.785%,18202805970.0,United States,,10780647,Health Care,Major Pharmaceuticals
VTRU,Vitru Limited Common Shares,$14.70,0.3,2.083%,338953379.0,Brazil,2020.0,1920,Consumer Services,Other Consumer Services
VTSI,VirTra Inc. Common Stock,$5.07,-0.03,-0.588%,39381377.0,United States,,12188,Consumer Durables,Miscellaneous manufacturing industries
VTVT,vTv Therapeutics Inc. Class A Common Stock,$2.88,-0.01,-0.346%,232257401.0,United States,2015.0,1557279,Health Care,Major Pharmaceuticals
VUZI,Vuzix Corporation Common Stock,$21.97,3.03,15.998%,1223803698.0,United States,,7661616,Technology,Radio And Television Broadcasting And Communications Equipment
VVOS,Vivos Therapeutics Inc. Common Stock,$7.44,0.09,1.224%,130200067.0,United States,2020.0,70389,Health Care,Medical/Dental Instruments
VVPR,VivoPower International PLC Ordinary Shares,$9.61,0.52,5.721%,162790767.0,United Kingdom,,187727,Public Utilities,Power Generation
VWTR,Vidler Water Resources Inc. Common Stock,$9.56,-0.32,-3.239%,177656979.0,United States,,70919,Finance,Real Estate
VXRT,Vaxart Inc Common Stock,$6.92,-0.145,-2.052%,814945370.0,United States,,5224129,Health Care,Biotechnology: Biological Products (No Diagnostic Substances)
VYGR,Voyager Therapeutics Inc. Common Stock,$5.46,-0.14,-2.50%,205589775.0,United States,2015.0,651651,Health Care,Biotechnology: Biological Products (No Diagnostic Substances)
VYNE,VYNE Therapeutics Inc. Common Stock,$7.78,0.39,5.277%,399341013.0,United States,2018.0,1359800,Health Care,Major Pharmaceuticals
WABC,Westamerica Bancorporation Common Stock,$63.63,-0.48,-0.749%,1705714393.0,United States,,88535,Finance,Major Banks
WAFD,Washington Federal Inc. Common Stock,$32.94,-0.11,-0.333%,2499862255.0,United States,,230334,Finance,Major Banks
WAFDP,Washington Federal Inc. Depositary Shares,$24.86,-0.07,-0.281%,0.0,United States,,71301,Finance,Major Banks
WAFU,Wah Fu Education Group Limited Ordinary Shares,$4.99,0.13,2.675%,21861355.0,China,2019.0,42948,Consumer Services,Other Consumer Services
WALDU,Waldencast Acquisition Corp. Units,$10.03,-0.04,-0.397%,0.0,United States,2021.0,1428038,Finance,Business Services
WASH,Washington Trust Bancorp Inc. Common Stock,$52.22,-0.24,-0.457%,901596003.0,United States,,48744,Finance,Major Banks
WATT,Energous Corporation Common Stock,$4.32,0.3,7.463%,264783220.0,United States,2014.0,1972379,Technology,Radio And Television Broadcasting And Communications Equipment
WB,Weibo Corporation American Depositary Share,$50.44,0.19,0.378%,11422743280.0,China,2014.0,1874178,Technology,Computer Software: Programming Data Processing
WBA,Walgreens Boots Alliance Inc. Common Stock,$54.10,-0.61,-1.115%,46744652454.0,United States,,5760519,Health Care,Medical/Nursing Services
WDAY,Workday Inc. Class A Common Stock,$260.72,3.6,1.40%,63328888000.0,United States,,1428940,Technology,EDP Services
WDC,Western Digital Corporation Common Stock,$71.30,1.53,2.193%,21824728863.0,United States,,3305259,Technology,Electronic Components
WDFC,WD-40 Company Common Stock,$293.31,-3.39,-1.143%,4014886822.0,United States,1973.0,68224,Basic Industries,Major Chemicals
WEN,Wendy's Company (The) Common Stock,$20.93,0.24,1.16%,4684994328.0,United States,,2113602,Consumer Services,Restaurants
WERN,Werner Enterprises Inc. Common Stock,$46.09,-0.13,-0.281%,3134564676.0,United States,1986.0,412941,Transportation,Trucking Freight/Courier Services
WETF,WisdomTree Investments Inc. Common Stock,$6.14,0.13,2.163%,919869104.0,United States,,1339844,Finance,Investment Bankers/Brokers/Service
WEYS,Weyco Group Inc. Common Stock,$23.46,-0.5,-2.087%,228438231.0,United States,,22503,Consumer Non-Durables,Apparel
WHF,WhiteHorse Finance Inc. Common Stock,$16.00,0.11,0.692%,328736512.0,United States,,59162,,
WHFBZ,WhiteHorse Finance Inc. 6.50% Notes due 2025,$26.00,0.0,0.00%,0.0,United States,,54,,
WHLM,Wilhelmina International Inc. Common Stock,$5.65,-0.32,-5.36%,29138994.0,United States,,8528,Consumer Services,Professional Services
WHLR,Wheeler Real Estate Investment Trust Inc. Common Stock,$3.14,0.23,7.904%,30466739.0,United States,2012.0,165984,Consumer Services,Real Estate Investment Trusts
WHLRD,Wheeler Real Estate Investment Trust Inc. Series D Cumulative Preferred Stock,$17.81,-0.04,-0.224%,0.0,United States,,1984,Consumer Services,Real Estate Investment Trusts
WHLRP,Wheeler Real Estate Investment Trust Inc. Class B Preferred Stock,$12.50,0.24,1.958%,0.0,United States,,640,Consumer Services,Real Estate Investment Trusts
WIFI,Boingo Wireless Inc. Common Stock,$14.15,0.06,0.426%,632766733.0,United States,2011.0,578688,Consumer Services,Telecommunications Equipment
WILC,G. Willi-Food International  Ltd. Ordinary Shares,$22.92,0.3134,1.386%,302934030.0,Israel,,1579,Consumer Non-Durables,Food Distributors
WIMI,WiMi Hologram Cloud Inc. American Depositary Share,$8.96,0.4,4.673%,598390966.0,China,2020.0,1541343,Technology,Computer Software: Prepackaged Software
WINA,Winmark Corporation Common Stock,$185.25,0.85,0.461%,687974411.0,United States,,13409,Consumer Services,Other Specialty Stores
WING,Wingstop Inc. Common Stock,$132.00,1.66,1.274%,3918816924.0,United States,2015.0,618932,Consumer Services,Restaurants
WINT,Windtree Therapeutics Inc. Common Stock,$4.12,0.06,1.478%,69716506.0,United States,,47191,Health Care,Biotechnology: Biological Products (No Diagnostic Substances)
WIRE,Encore Wire Corporation Common Stock,$71.08,0.86,1.225%,1466461787.0,United States,1992.0,78222,Capital Goods,Metal Fabrications
WISA,Summit Wireless Technologies Inc. Common Stock,$3.47,0.22,6.769%,36324657.0,United States,2018.0,151571,Technology,Semiconductors
WISH,ContextLogic Inc. Class A Common Stock,$18.84,0.5,2.726%,13109647662.0,United States,2020.0,3419371,Consumer Services,Catalog/Specialty Distribution
WIX,Wix.com Ltd. Ordinary Shares,$309.44,7.91,2.623%,17217322673.0,Israel,2013.0,478179,Technology,Computer Software: Programming Data Processing
WKEY,WISeKey International Holding AG American Depositary Shares,$7.97,0.96,13.695%,140926680.0,Switzerland,,6358862,Technology,EDP Services
WKHS,Workhorse Group Inc. Common Stock,$16.93,0.24,1.438%,2090964757.0,United States,,9468510,Capital Goods,Auto Manufacturing
WLDN,Willdan Group Inc. Common Stock,$42.36,-1.62,-3.683%,515097600.0,United States,2006.0,106902,Consumer Services,Military/Government/Technical
WLFC,Willis Lease Finance Corporation Common Stock,$44.09,8.74,24.724%,263442644.0,United States,1996.0,117414,Consumer Durables,Industrial Specialties
WLTW,Willis Towers Watson Public Limited Company Ordinary Shares,$221.68,-0.42,-0.189%,28590187312.0,United Kingdom,,721557,Finance,Specialty Insurers
WMG,Warner Music Group Corp. Class A Common Stock,$34.55,0.46,1.349%,17770867474.0,United States,2020.0,1209883,Consumer Services,Services-Misc. Amusement & Recreation
WNEB,Western New England Bancorp Inc. Common Stock,$8.54,-0.08,-0.928%,214385222.0,United States,,171878,Finance,Savings Institutions
WNW,Wunong Net Technology Company Limited Ordinary Shares,$11.48,0.62,5.709%,287000000.0,China,2020.0,1002870,Consumer Services,Catalog/Specialty Distribution
WOOF,Petco Health and Wellness Company Inc. Class A Common Stock,$23.43,0.45,1.958%,7075993598.0,United States,2021.0,1585630,Consumer Services,Other Specialty Stores
WORX,SCWorx Corp. Common Stock,$2.14,0.03,1.422%,21104104.0,United States,2016.0,378263,Consumer Services,Services-Misc. Amusement & Recreation
WPRT,Westport Fuel Systems Inc Common Shares,$9.16,0.41,4.686%,1255290778.0,Canada,,3125695,Energy,Industrial Machinery/Components
WRAP,Wrap Technologies Inc. Common Stock,$5.91,0.28,4.973%,222479326.0,United States,,312781,Capital Goods,Ordnance And Accessories
WRLD,World Acceptance Corporation Common Stock,$141.22,-1.88,-1.314%,960957051.0,United States,1991.0,25854,Finance,Finance: Consumer Services
WSBC,WesBanco Inc. Common Stock,$37.20,0.5,1.362%,2502024644.0,United States,,265397,Finance,Major Banks
WSBCP,WesBanco Inc. Depositary Shares Each Representing a 1/40th Interest in a Share of 6.75% Fixed-Rate Reset Non-Cumulative Perpetual Preferred Stock Series A,$27.6375,0.0875,0.318%,0.0,United States,,16782,Finance,Major Banks
WSBF,Waterstone Financial Inc. Common Stock (MD),$20.80,0.05,0.241%,522446787.0,United States,,87325,Finance,Savings Institutions
