Symbol,Name,Last Sale,Net Change,% Change,Market Cap,Country,IPO Year,Volume,Sector,Industry
PSA^L,Public Storage Depositary Shares Each Representing 1/1000 of a 4.625% Cumulative Preferred Share of Beneficial Interest Series L par value $0.01 per share,$27.23,0.37,1.378%,,United States,,50901,Consumer Services,Real Estate Investment Trusts
PSA^M,Public Storage Depositary Shares Each Representing 1/1000 of a 4.125% Cumulative Preferred Share of Beneficial Interest Series M,$26.05,0.24,0.93%,,United States,,11062,,
PSA^N,Public Storage Depositary Shares Each Representing 1/1000 of a 3.875% Cumulative Preferred Share of Beneficial Interest Series N,$25.29,0.28,1.12%,,United States,,30501,,
PSA^O,Public Storage Depositary Shares Each Representing 1/1000 of a 3.900% Cumulative Preferred Share of Beneficial Interest Series O,$25.93,-0.10,-0.384%,,United States,,21420,,
PSB,PS Business Parks Inc. Common Stock,$159.20,4.62,2.989%,4376198493.00,United States,,84544,Consumer Services,Real Estate Investment Trusts
PSB^W,PS Business Parks Inc. Depositary Shares Each Representing 1/1000 of a Share of 5.20% Cumulative Preferred Stock Series W,$25.66,-0.32,-1.232%,,United States,,28672,,
PSB^X,PS Business Parks Inc. Depositary Shares Each Representing 1/1000 of a Share of 5.25% Cumulative Preferred Stock Series X,$26.15,0.06,0.23%,,United States,,7509,,
PSB^Y,PS Business Parks Inc. 5.20% Cumulative Preferred Stock Series Y,$26.31,0.01,0.038%,,United States,,9999,,
PSB^Z,PS Business Parks Inc. Depositary Shares Each Representing 1/1000 of a Share of 4.875% Cumulative Preferred Stock Series Z  par value $0.01 per share,$26.79,0.27,1.018%,,United States,,13924,,
PSF,Cohen & Steers Select Preferred and Income Fund Inc. Common Stock,$27.84,0.14,0.505%,334541810.00,,2010,18166,,
PSFE,Paysafe Limited Common Shares,$14.60,1.10,8.148%,0.00,,2021,9497202,,
PSN,Parsons Corporation Common Stock,$40.47,0.03,0.074%,4142535991.00,,2019,354301,Technology,EDP Services
PSO,Pearson Plc Common Stock,$10.74,0.05,0.468%,8095060963.00,United Kingdom,,148730,Consumer Services,Books
PSTG,Pure Storage Inc. Class A Common Stock,$21.97,0.43,1.996%,6158977394.00,,2015,3499608,Technology,Electronic Components
PSTH,Pershing Square Tontine Holdings Ltd. Class A Common Stock,$24.47,0.46,1.916%,4894002447.00,,2020,1351778,Finance,Business Services
PSTL,Postal Realty Trust Inc. Class A Common Stock,$17.30,0.12,0.698%,228392593.00,,2019,67263,Consumer Services,Real Estate Investment Trusts
PSX,Phillips 66 Common Stock,$83.16,1.62,1.987%,36334770983.00,United States,,2732494,Energy,Integrated oil Companies
PSXP,Phillips 66 Partners LP Common Units representing limited partner interest in the Partnership,$33.18,1.51,4.768%,7576326044.00,United States,2013,1005649,Energy,Natural Gas Distribution
PTA,Cohen & Steers Tax-Advantaged Preferred Securities and Income Fund Common Shares of Beneficial Interest,$24.80,-0.05,-0.201%,1370781734.00,,2020,101829,,
PTR,PetroChina Company Limited Common Stock,$36.52,0.37,1.024%,66839261093.00,China,,192457,Energy,Oil & Gas Production
PTY,Pimco Corporate & Income Opportunity Fund,$18.29,0.02,0.109%,2023179644.00,United States,2002,481311,,
PUK,Prudential Public Limited Company Common Stock,$43.22,0.53,1.242%,56391680263.00,United Kingdom,,122316,Finance,Life Insurance
PUK^,Prudential Public Limited Company 6.75% Perpetual Subordinated Captial Security,$27.92,0.26,0.94%,,United Kingdom,,11794,,
PUK^A,Prudential Public Limited Company 6.50% Perpetual Subordinated Capital Securities Exchangeable at the Issuer's Option Into Non-Cumulative Dollar Denominated Preference Shares,$27.19,0.19,0.704%,,United Kingdom,,25162,,
PUMP,ProPetro Holding Corp. Common Stock,$11.13,0.47,4.409%,1135903481.00,United States,2017,745834,Energy,Oilfield Services/Equipment
PV,Primavera Capital Acquisition Corporation Class A Ordinary Shares,$9.83,0.03,0.306%,528362500.00,,2021,16330,Finance,Business Services
PVG,Pretium Resources Inc. Ordinary Shares (Canada),$10.97,0.60,5.786%,2059980431.00,Canada,,1433102,Basic Industries,Precious Metals
PVH,PVH Corp. Common Stock,$100.98,-4.72,-4.465%,7179703245.00,United States,,1398671,Consumer Non-Durables,Apparel
PVL,Permianville Royalty Trust Trust Units ,$1.515,0.025,1.678%,49995000.00,United States,2011,259480,Energy,Oil & Gas Production
PWR,Quanta Services Inc. Common Stock,$89.17,1.19,1.353%,12338007674.00,United States,,1358829,Capital Goods,Engineering & Construction
PXD,Pioneer Natural Resources Company Common Stock,$164.60,5.78,3.639%,35649114088.00,United States,,2201288,Energy,Oil & Gas Production
PYN,PIMCO New York Municipal Income Fund III Common Shares of Beneficial Interest,$9.77,-0.03,-0.306%,55962560.00,United States,2002,7242,,
PYS,Merrill Lynch Depositor Inc PPlus Tr Ser RRD-1 Tr Ctf Cl A,$22.6457,0.1457,0.648%,0.00,United States,,4823,Finance,Finance: Consumer Services
PYT,PPlus Tr GSC-2 Tr Ctf Fltg Rate,$24.055,0.305,1.284%,0.00,United States,,500,Finance,Finance: Consumer Services
PZC,PIMCO California Municipal Income Fund III Common Shares of Beneficial Interest,$10.64,0.09,0.853%,238133840.00,United States,2002,24368,,
PZN,Pzena Investment Management Inc Class A Common Stock,$11.21,0.68,6.458%,813733463.00,United States,2007,83388,Finance,Investment Managers
QD,Qudian Inc. American Depositary Shares each representing one Class A Ordinary Share,$2.29,0.01,0.439%,581040209.00,China,2017,4111125,Finance,Finance: Consumer Services
QFTA,Quantum FinTech Acquisition Corporation Common Stock,$9.68,0.02,0.207%,0.00,,2021,331309,Finance,Business Services
QGEN,Qiagen N.V. Common Shares ,$49.29,0.60,1.232%,11231776180.00,Netherlands,,775162,Health Care,Biotechnology: Biological Products (No Diagnostic Substances)
QS,QuantumScape Corporation Class A Common Stock,$49.30,4.55,10.168%,18665966838.00,United States,2020,24912058,Miscellaneous,Industrial Machinery/Components
QSR,Restaurant Brands International Inc. Common Shares,$65.55,0.55,0.846%,19869074127.00,Canada,2014,1109508,Consumer Services,Restaurants
QTS,QTS Realty Trust Inc. Class A Common Stock,$64.20,2.16,3.482%,4172133493.00,United States,2013,1064859,Consumer Services,Real Estate Investment Trusts
QTS^A,QTS Realty Trust Inc. 7.125% Series A Cumulative Redeemable Perpetual Preferred Stock,$28.61,0.65,2.325%,,United States,,15048,,
QTS^B,QTS Realty Trust Inc. 6.50% Series B Cumulative Convertible Perpetual Preferred Stock,$143.00,2.49,1.772%,,United States,,5297,,
QTWO,Q2 Holdings Inc. Common Stock,$103.10,2.90,2.894%,5732309687.00,,2014,515077,Technology,Computer Software: Prepackaged Software
QUAD,Quad Graphics Inc Class A Common Stock,$3.80,0.27,7.649%,203894738.00,United States,,267902,Miscellaneous,Publishing
QUOT,Quotient Technology Inc. Common Stock,$15.88,-0.46,-2.815%,1470150201.00,,2014,1317834,Consumer Services,Advertising
QVCC,QVC Inc. 6.250% Senior Secured Notes due 2068,$25.48,0.43,1.717%,0.00,United States,2019,47932,Consumer Services,Catalog/Specialty Distribution
QVCD,QVC Inc. 6.375% Senior Secured Notes due 2067,$25.50,0.09,0.354%,0.00,United States,2018,21693,Consumer Services,Catalog/Specialty Distribution
R,Ryder System Inc. Common Stock,$76.91,1.26,1.666%,4139845107.00,United States,,249760,Consumer Services,Rental/Leasing Companies
RA,Brookfield Real Assets Income Fund Inc. Common Stock,$20.74,0.04,0.193%,910285092.00,,2016,382233,,
RAAS,Cloopen Group Holding Limited American Depositary Shares each representing two Class A Ordinary Shares,$12.90,-0.83,-6.045%,2062004383.00,,2021,1127800,Technology,Computer Software: Prepackaged Software
RACE,Ferrari N.V. Common Shares,$208.04,-1.24,-0.593%,51660682116.00,,2015,487014,Capital Goods,Auto Manufacturing
RAD,Rite Aid Corporation Common Stock,$20.94,0.48,2.346%,1156398161.00,United States,,1979825,Health Care,Medical/Nursing Services
RAMP,LiveRamp Holdings Inc. Common Stock,$53.06,1.18,2.274%,3550743948.00,United States,2018,625321,Technology,EDP Services
RBA,Ritchie Bros. Auctioneers Incorporated Common Stock,$60.48,1.93,3.296%,6650869357.00,Canada,,504605,Miscellaneous,Business Services
RBAC,RedBall Acquisition Corp. Class A Ordinary Shares,$9.96,0.01,0.101%,715875000.00,United States,2020,215485,Finance,Business Services
RBC,Regal Beloit Corporation Common Stock,$145.65,2.97,2.082%,5916809425.00,United States,,214444,Consumer Durables,Metal Fabrications
RBLX,Roblox Corporation Class A Common Stock,$67.34,2.51,3.872%,37073393768.00,,2021,4056197,Technology,Computer Software: Prepackaged Software
RC,Ready Capital Corproation Common Stock,$13.55,0.13,0.969%,964720570.00,United States,2013,462199,Consumer Services,Real Estate Investment Trusts
RC^B,Ready Capital Corporation 8.625% Series B Cumulative Preferred Stock,$25.32,0.07,0.277%,,United States,,5426,,
RC^C,Ready Capital Corporation 6.25% Series C Cumulative Convertible Preferred Stock,$24.8707,-0.1093,-0.438%,,United States,,3873,,
RC^D,Ready Capital Corporation 7.625% Series D Cumulative Redeemable Preferred Stock,$25.05,0.05,0.20%,,United States,,23047,,
RCA,Ready Capital Corporation 7.00% Convertible Senior Notes due 2023,$26.53,-0.03,-0.113%,0.00,United States,2017,4176,Consumer Services,Real Estate Investment Trusts
RCB,Ready Capital Corporation 6.20% Senior Notes due 2026,$26.18,-0.05,-0.191%,0.00,United States,2019,2130,Consumer Services,Real Estate Investment Trusts
RCC,Ready Capital Corporation 5.75% Senior Notes due 2026,$26.03,-0.02,-0.077%,,United States,2021,14237,Consumer Services,Real Estate Investment Trusts
RCI,Rogers Communication Inc. Common Stock,$46.94,0.84,1.822%,23404727771.00,Canada,,467925,Consumer Services,Television Services
RCL,D/B/A Royal Caribbean Cruises Ltd. Common Stock,$86.67,1.06,1.238%,22062638757.00,United States,1993,2394976,Consumer Services,Marine Transportation
RCS,PIMCO Strategic Income Fund Inc.,$7.32,-0.01,-0.136%,323441520.00,United States,1994,91241,,
RCUS,Arcus Biosciences Inc. Common Stock,$28.83,0.75,2.671%,2043361480.00,,2018,449242,Health Care,Major Pharmaceuticals
RDN,Radian Group Inc. Common Stock,$23.26,0.01,0.043%,4458682977.00,United States,,696815,Finance,Property-Casualty Insurers
RDS/B,Royal Dutch Shell PLC,$37.46,0.63,1.711%,,Netherlands,,3916197,,
RDY,Dr. Reddy's Laboratories Ltd Common Stock,$62.72,1.33,2.166%,10407752221.00,India,,167327,Health Care,Major Pharmaceuticals
RE,Everest Re Group Ltd. Common Stock,$251.11,3.30,1.332%,10042306245.00,Bermuda,,235406,Finance,Property-Casualty Insurers
RELX,RELX PLC PLC American Depositary Shares (Each representing One Ordinary Share),$25.60,0.44,1.749%,49471848448.00,United Kingdom,2015,431930,Miscellaneous,Business Services
RENN,Renren Inc. American Depositary Shares each representing fifteen Class A ordinary shares,$8.93,-0.12,-1.326%,210567989.00,China,2011,41311,Consumer Durables,Automotive Aftermarket
RES,RPC Inc. Common Stock,$5.65,0.25,4.63%,1219331947.00,United States,,951039,Energy,Oilfield Services/Equipment
REV,Revlon Inc. New Common Stock,$12.23,-0.10,-0.811%,652327629.00,United States,1996,166484,Consumer Non-Durables,Package Goods/Cosmetics
REVG,REV Group Inc. Common Stock,$19.23,0.07,0.365%,1240715389.00,United States,2017,215803,Capital Goods,Auto Manufacturing
REX,REX American Resources Corporation,$89.14,4.97,5.905%,534126880.00,United States,,11411,Basic Industries,Major Chemicals
REXR,Rexford Industrial Realty Inc. Common Stock,$51.83,1.43,2.837%,6812012494.00,United States,2013,546069,Consumer Services,Real Estate Investment Trusts
REXR^A,Rexford Industrial Realty Inc. 5.875% Series A Cumulative Redeemable Preferred Stock,$25.27,0.0001,0.00%,,United States,,5463,,
REXR^B,Rexford Industrial Realty Inc. 5.875% Series B Cumulative Redeemable Preferred Stock,$26.00,0.27,1.049%,,United States,,2642,,
REXR^C,Rexford Industrial Realty Inc. 5.625% Series C Cumulative Redeemable Preferred Stock par value $0.01 per share,$25.92,-0.40,-1.52%,,United States,,3330,,
REZI,Resideo Technologies Inc. Common Stock ,$29.60,1.35,4.779%,4236928460.00,,2018,766653,Capital Goods,Wholesale Distributors
RF,Regions Financial Corporation Common Stock,$21.06,0.40,1.936%,20231795114.00,United States,,8296076,Finance,Major Banks
RF^A,Regions Financial Corporation Depositary Shares Representing 1/40th Perpetual Preferred Series A,$26.33,-0.01,-0.038%,,United States,,30208,,
RF^B,Regions Financial Corporation Depositary Shares Representing 1/40th Perpetual Preferred Series B,$28.34,0.10,0.354%,,United States,,25673,,
RF^C,Regions Financial Corporation Depositary Shares each Representing a 1/40th Interest in a  Share of 5.700% Fixed-to-Floating Rate Non-Cumulative  Perpetual Preferred Stock Series C,$27.94,0.26,0.939%,,United States,,21396,,
RFI,Cohen & Steers Total Return Realty Fund Inc. Common Stock,$14.98,0.35,2.392%,393233973.00,United States,1993,73714,,
RFL,Rafael Holdings Inc. Class B Common Stock,$40.64,0.72,1.804%,677535287.00,United States,2018,40881,Finance,Real Estate
RFM,RiverNorth Flexible Municipal Income Fund Inc. Common Stock,$22.2462,0.1862,0.844%,136028817.00,,2020,10933,,
RFMZ,RiverNorth Flexible Municipal Income Fund II Inc. Common Stock,$20.115,0.085,0.424%,0.00,,2021,8514,,
RFP,Resolute Forest Products Inc. Common Stock,$10.72,-0.23,-2.10%,866321996.00,Canada,,675245,Basic Industries,Paper
RGA,Reinsurance Group of America Incorporated Common Stock,$127.43,1.38,1.095%,8661796332.00,United States,,359171,Finance,Life Insurance
RGR,Sturm Ruger & Company Inc. Common Stock,$67.72,1.65,2.497%,1188147400.00,United States,,212452,Capital Goods,Ordnance And Accessories
RGS,Regis Corporation Common Stock,$12.82,0.26,2.07%,496898918.00,United States,1991,107779,Consumer Services,Other Consumer Services
RGT,Royce Global Value Trust Inc. Common Stock,$14.345,0.135,0.95%,80343347.00,,2013,3335,,
RH,RH Common Stock,$595.63,-0.97,-0.163%,12151704347.00,United States,2012,385004,Consumer Services,Other Specialty Stores
RHI,Robert Half International Inc. Common Stock,$77.66,-0.41,-0.525%,8785276162.00,United States,,1923950,Technology,Professional Services
RHP,Ryman Hospitality Properties Inc. (REIT),$78.85,1.34,1.729%,4335451025.00,United States,,213510,Consumer Services,Real Estate Investment Trusts
RICE,Rice Acquisition Corp. Class A Common Stock,$10.10,-0.01,-0.099%,302079385.00,United States,2020,45944,Finance,Business Services
RIG,Transocean Ltd (Switzerland) Common Stock,$3.64,0.09,2.535%,2242331524.00,Switzerland,,12531233,Energy,Oil & Gas Production
RIO,Rio Tinto Plc Common Stock,$77.98,0.33,0.425%,126241190908.00,Australia,2002,1835020,Basic Industries,Precious Metals
RIV,RiverNorth Opportunities Fund Inc. Common Stock,$17.53,0.09,0.516%,164606700.00,,2015,89374,,
RJF,Raymond James Financial Inc. Common Stock,$126.51,3.95,3.223%,17421837840.00,United States,,762187,Finance,Investment Bankers/Brokers/Service
RKT,Rocket Companies Inc. Class A Common Stock,$22.55,-0.54,-2.339%,44749437497.00,United States,2020,9779687,Finance,Finance: Consumer Services
RL,Ralph Lauren Corporation Common Stock,$119.94,-3.22,-2.614%,8769816818.00,United States,1997,1034018,Consumer Non-Durables,Apparel
RLGY,Realogy Holdings Corp. Common Stock,$15.72,0.59,3.90%,1836327461.00,United States,2012,1120928,Finance,Real Estate
RLI,RLI Corp. Common Stock (DE),$113.40,1.83,1.64%,5121776772.00,United States,,86493,Finance,Property-Casualty Insurers
RLJ,RLJ Lodging Trust Common Shares of Beneficial Interest $0.01 par value,$15.70,0.22,1.421%,2590068501.00,United States,2011,981745,Consumer Services,Real Estate Investment Trusts
RLJ^A,RLJ Lodging Trust $1.95 Series A Cumulative Convertible  Preferred Shares,$28.65,0.89,3.206%,,United States,,222118,,
RLX,RLX Technology Inc. American Depositary Shares each representing the right to receive one (1) Class A ordinary share,$10.95,0.59,5.695%,17008805492.00,,2021,7262906,Consumer Non-Durables,Farming/Seeds/Milling
RM,Regional Management Corp. Common Stock,$34.76,0.10,0.289%,377714674.00,United States,2012,33598,Finance,Finance: Consumer Services
RMAX,RE/MAX Holdings Inc. Class A Common Stock,$40.78,1.39,3.529%,1269718821.00,,2013,75238,Finance,Real Estate
RMD,ResMed Inc. Common Stock,$194.44,0.42,0.216%,28292786293.00,United States,,485717,Health Care,Medical/Dental Instruments
RMI,RiverNorth Opportunistic Municipal Income Fund Inc. Common Stock,$22.05,0.08,0.364%,140530559.00,,2018,8176,,
RMM,RiverNorth Managed Duration Municipal Income Fund Inc. Common Stock,$18.78,0.18,0.968%,370708129.00,,2019,35683,,
RMO,Romeo Power Inc. Class A Common Stock,$8.28,-0.05,-0.60%,1049797610.00,,2019,12524571,Capital Goods,Auto Parts:O.E.M.
RMPL^,RiverNorth Specialty Finance Corporation 5.875% ,$25.53,0.05,0.196%,,,,1750,,
RMT,Royce Micro-Cap Trust Inc. Common Stock,$11.48,0.18,1.593%,502419766.00,United States,,156746,,
RNG,RingCentral Inc. Class A Common Stock,$305.01,7.13,2.394%,27601128710.00,,2013,944616,Technology,EDP Services
RNGR,Ranger Energy Services Inc. Class A Common Stock,$5.78,0.30,5.474%,89121161.00,United States,2017,10302,Energy,Oilfield Services/Equipment
RNP,Cohen & Steers REIT and Preferred and Income Fund Inc. Common Shares,$24.59,0.20,0.82%,1170046126.00,United States,2003,146336,,
RNR,RenaissanceRe Holdings Ltd. Common Stock,$165.00,4.75,2.964%,8210630505.00,Bermuda,,387786,Finance,Property-Casualty Insurers
RNR^E,RenaissanceRe Holdings Ltd. 5.375% Series E Preference Shares,$25.44,0.08,0.315%,,Bermuda,,16960,,
RNR^F,RenaissanceRe Holdings Ltd. Depositary Shares each Representing a 1/1000th Interest in a 5.750% Series F Preference Share,$27.48,0.39,1.44%,,Bermuda,,13593,,
ROG,Rogers Corporation Common Stock,$192.66,4.45,2.364%,3598240114.00,United States,,65993,Basic Industries,Major Chemicals
ROK,Rockwell Automation Inc. Common Stock,$263.44,-2.00,-0.753%,30599894539.00,United States,,784491,Capital Goods,Industrial Machinery/Components
ROL,Rollins Inc. Common Stock,$34.83,0.41,1.191%,17140864320.00,United States,,1083649,Finance,Diversified Commercial Services
ROP,Roper Technologies Inc. Common Stock,$410.35,7.01,1.738%,43061963629.00,United States,1992,421804,Capital Goods,Industrial Machinery/Components
ROT,Rotor Acquisition Corp. Class A Common Stock,$9.725,-0.075,-0.765%,0.00,,2021,134610,Finance,Business Services
RPAI,Retail Properties of America Inc. Class A Common Stock,$10.77,0.29,2.767%,2311385693.00,United States,2012,908974,Consumer Services,Real Estate Investment Trusts
RPLA,Replay Acquisition Corp. Ordinary Shares,$9.48,-0.07,-0.733%,340687500.00,,2019,241175,Finance,Business Services
RPM,RPM International Inc. Common Stock,$92.43,0.58,0.631%,12025400418.00,United States,,424275,Basic Industries,Paints/Coatings
RPT,RPT Realty Common Stock,$11.78,0.37,3.243%,955269732.00,United States,,358380,Consumer Services,Real Estate Investment Trusts
RPT^D,RPT Realty 7.25% ,$54.64,0.35,0.645%,,United States,,7686,,
RQI,Cohen & Steers Quality Income Realty Fund Inc Common Shares,$14.08,0.16,1.149%,1890144664.00,United States,2002,751737,,
RRC,Range Resources Corporation Common Stock,$11.06,0.73,7.067%,2859793579.00,United States,,4166230,Energy,Oil & Gas Production
RRD,R.R. Donnelley & Sons Company Common Stock,$4.19,0.13,3.202%,299214453.00,United States,,627087,Miscellaneous,Publishing
RS,Reliance Steel & Aluminum Co. Common Stock (DE),$155.65,3.36,2.206%,9899636046.00,United States,1994,409714,Basic Industries,Metal Fabrications
RSF,RiverNorth Specialty Finance Corporation,$17.90,0.0001,0.001%,92500022.00,,2019,7228,,
RSG,Republic Services Inc. Common Stock,$99.72,0.37,0.372%,31800539772.00,United States,1998,898313,Public Utilities,Environmental Services
RSI,Rush Street Interactive Inc. Class A Common Stock,$16.54,0.20,1.224%,3517461551.00,,2020,986128,Consumer Services,Services-Misc. Amusement & Recreation
RTP,Reinvent Technology Partners Class A Ordinary Shares,$10.17,0.02,0.197%,877162500.00,United States,2020,1173289,Finance,Business Services
RTPZ,Reinvent Technology Partners Z Class A Ordinary Shares,$10.14,0.13,1.299%,291525000.00,United States,2021,187856,Finance,Business Services
RTX,Raytheon Technologies Corporation Common Stock,$77.28,0.01,0.013%,117159024599.00,United States,,6166211,Capital Goods,Aerospace
RVI,Retail Value Inc. Common Stock ,$18.99,0.28,1.497%,400370955.00,United States,2018,84892,Finance,Real Estate
RVLV,Revolve Group Inc. Class A Common Stock,$45.32,0.39,0.868%,3247881140.00,,2019,743631,Consumer Services,Catalog/Specialty Distribution
RVT,Royce Value Trust Inc. Common Stock,$18.37,0.26,1.436%,1873238444.00,United States,1986,153999,,
RWT,Redwood Trust Inc. Common Stock,$10.69,0.28,2.69%,1198242164.00,United States,1995,826088,Consumer Services,Real Estate Investment Trusts
RXN,Rexnord Corporation Common Stock,$47.92,0.83,1.763%,5731901107.00,United States,2012,615653,Technology,Industrial Machinery/Components
RY,Royal Bank Of Canada Common Stock,$92.48,0.27,0.293%,131770432814.00,Canada,,906942,Finance,Commercial Banks
RY^T,Royal Bank Of Canada 6.750% Fixed Rate/Floating Rate Noncumulative First Preferred Shares Series C-2,$28.70,0.00,0.00%,,Canada,,530,,
RYAM,Rayonier Advanced Materials Inc. Common Stock,$9.46,0.39,4.30%,599384049.00,United States,2014,417572,Basic Industries,Paper
RYB,RYB Education Inc. American depositary shares each representing one Class A ordinary share,$3.68,-0.10,-2.646%,101517753.00,,2017,173811,Consumer Services,Other Consumer Services
RYI,Ryerson Holding Corporation Common Stock,$16.75,-0.29,-1.702%,638466400.00,United States,2014,232936,Basic Industries,Metal Fabrications
RYN,Rayonier Inc. REIT Common Stock,$33.59,1.34,4.155%,4629612625.00,United States,,510425,Consumer Services,Real Estate Investment Trusts
RZA,Reinsurance Group of America Incorporated 6.20% Fixed-to-Floating Rate Subordinated Debentures due 2042,$27.10,0.23,0.856%,0.00,United States,,46760,Finance,Life Insurance
RZB,Reinsurance Group of America Incorporated 5.75% Fixed-To-Floating Rate Subordinated Debentures due 2056,$28.20,0.06,0.213%,0.00,United States,2016,99340,Finance,Life Insurance
SA,Seabridge Gold Inc. Ordinary Shares (Canada),$16.99,0.82,5.071%,1270982211.00,Canada,,428356,Basic Industries,Precious Metals
SAF,Saratoga Investment Corp 6.25% Notes due 2023,$25.70,0.08,0.312%,0.00,United States,2018,798,,
SAFE,Safehold Inc. Common Stock,$71.00,0.90,1.284%,3780745669.00,United States,2017,109882,Consumer Services,Real Estate
SAH,Sonic Automotive Inc. Common Stock,$49.12,-0.45,-0.908%,2019535349.00,United States,1997,323800,Consumer Durables,Automotive Aftermarket
SAIC,SCIENCE APPLICATIONS INTERNATIONAL CORPORATION Common Stock,$82.60,-0.99,-1.184%,4796275141.00,,,441344,Technology,EDP Services
SAIL,SailPoint Technologies Holdings Inc. Common Stock,$52.51,1.87,3.693%,4828856882.00,United States,2017,988606,Technology,Computer Software: Prepackaged Software
SAK,Saratoga Investment Corp 7.25% Notes due 2025,$26.79,0.0001,0.00%,0.00,United States,2020,645,,
SAM,Boston Beer Company Inc. (The) Common Stock,$1184.68,-21.60,-1.791%,14531705441.00,United States,,95558,Consumer Non-Durables,Beverages (Production/Distribution)
SAN,Banco Santander S.A. Sponsored ADR (Spain),$3.42,-0.01,-0.292%,59208841382.00,Spain,,2141118,Finance,Commercial Banks
SAND          ,Sandstorm Gold Ltd. Ordinary Shares (Canada),$7.04,0.24,3.529%,1374582831.00,Canada,,1531419,Basic Industries,Precious Metals
SAP,SAP  SE ADS,$125.75,2.96,2.411%,148332102005.00,Germany,,786782,Technology,Computer Software: Prepackaged Software
SAR,Saratoga Investment Corp New,$25.72,0.40,1.58%,287293120.00,United States,,84887,,
SAVE,Spirit Airlines Inc. Common Stock,$37.36,0.46,1.247%,3653183416.00,United States,,2300682,Transportation,Air Freight/Delivery Services
SB,Safe Bulkers Inc Common Stock ($0.001 par value),$2.45,0.00,0.00%,250384292.00,Monaco,2008,512541,Transportation,Marine Transportation
SB^C,Safe Bulkers Inc Cumulative Redeemable Perpetual Preferred Series C (Marshall Islands),$24.36,0.05,0.206%,,Monaco,,5860,,
SB^D,Safe Bulkers Inc Perpetual Preferred Series D (Marshall Islands),$24.52,-0.18,-0.729%,,Monaco,,6862,,
SBBA,Scorpio Tankers Inc. 7.00% Senior Notes due 2025,$25.00,0.03,0.12%,0.00,Monaco,2020,27943,Transportation,Marine Transportation
SBG,Sandbridge Acquisition Corporation Class A Common Stock,$9.90,-0.01,-0.101%,284625000.00,,2020,108510,Capital Goods,Industrial Machinery/Components
SBH,Sally Beauty Holdings Inc. (Name to be changed from Sally Holdings Inc.) Common Stock,$20.18,0.05,0.248%,2276593300.00,United States,,920238,Consumer Services,Other Specialty Stores
SBI,Western Asset Intermediate Muni Fund Inc Common Stock,$9.35,0.06,0.646%,131669645.00,United States,1992,12929,,
SBOW,SilverBow Resorces Inc. Common Stock,$8.00,0.22,2.828%,95493432.00,,,28193,Energy,Oil & Gas Production
SBR,Sabine Royalty Trust Common Stock,$31.08,0.72,2.372%,453126043.00,United States,,26514,Energy,Oil & Gas Production
SBS,Companhia de saneamento Basico Do Estado De Sao Paulo - Sabesp American Depositary Shares (Each repstg 250 Common Shares),$7.23,-0.10,-1.364%,4941776353.00,Brazil,2002,1195086,Public Utilities,Water Supply
SBSW,D/B/A Sibanye-Stillwater Limited ADS,$18.43,0.57,3.191%,13470351097.00,,,1696042,,
SC,Santander Consumer USA Holdings Inc. Common Stock,$27.21,0.15,0.554%,8328191148.00,,2014,668035,Finance,Finance: Consumer Services
SCCO,Southern Copper Corporation Common Stock,$69.41,1.54,2.269%,53659015601.00,United States,,1121497,Basic Industries,Precious Metals
SCD,LMP Capital and Income Fund Inc. Common Stock,$12.79,0.09,0.709%,229727623.00,United States,2004,61999,,
SCE^G,SCE Trust II Trust Preferred Securities,$24.32,0.31,1.291%,,United States,,132262,,
SCE^H,SCE Trust III Fixed/Floating Rate Trust Preference Securities,$25.54,0.05,0.196%,,United States,,33239,,
SCE^J,Southern California Edison Company 5.375% Fixed-to-Floating Rate Trust Preference Securities,$25.35,0.14,0.555%,,United States,,59593,,
SCE^K,Southern California Edison Company 5.45% Fixed-to-Floating Rate Trust Preference Securities,$25.85,0.29,1.135%,,United States,,40443,,
