Symbol,Name,Last Sale,Net Change,% Change,Market Cap,Country,IPO Year,Volume,Sector,Industry
CVE,Cenovus Energy Inc Common Stock,$7.87,0.35,4.654%,15876842820.00,Canada,,8782625,Energy,Oil & Gas Production
CVEO,Civeo Corporation (Canada) Common Shares,$16.01,0.70,4.572%,228723503.00,,2014,43849,Consumer Services,Hotels/Resorts
CVI,CVR Energy Inc. Common Stock,$20.60,1.42,7.404%,2070930339.00,United States,2007,678616,Energy,Integrated oil Companies
CVNA,Carvana Co. Class A Common Stock,$265.32,2.92,1.113%,45704273397.00,United States,2017,874170,Consumer Durables,Automotive Aftermarket
CVS,CVS Health Corporation Common Stock,$74.30,-0.93,-1.236%,97433671002.00,United States,,6958949,Health Care,Medical/Nursing Services
CVX,Chevron Corporation Common Stock,$105.75,0.96,0.916%,203880608971.00,United States,,8514681,Energy,Integrated oil Companies
CW,Curtiss-Wright Corporation Common Stock,$119.93,1.33,1.121%,4907404876.00,United States,,186450,Technology,Industrial Machinery/Components
CWEN,Clearway Energy Inc. Class C Common Stock,$28.86,0.72,2.559%,5821442577.00,United States,2015,766834,Public Utilities,Electric Utilities: Central
CWH,Camping World Holdings Inc. Class A Commom Stock,$36.92,0.54,1.484%,3264718601.00,United States,2016,848058,Consumer Durables,Automotive Aftermarket
CWK,Cushman & Wakefield plc Ordinary Shares,$16.50,0.18,1.103%,3665954952.00,,2018,350174,Finance,Real Estate
CWT,California Water Service Group Common Stock,$56.21,-0.13,-0.231%,2830061811.00,United States,,148783,Public Utilities,Water Supply
CX,Cemex S.A.B. de C.V. Sponsored ADR,$6.85,-0.12,-1.722%,10089345169.00,Mexico,,6792639,Capital Goods,Building Materials
CXE,MFS High Income Municipal Trust Common Stock,$5.125,0.025,0.49%,161547939.00,United States,1989,19944,,
CXH,MFS Investment Grade Municipal Trust Common Stock,$9.87,0.06,0.612%,89918118.00,United States,1989,4941,,
CXP,Columbia Property Trust Inc. Common Stock,$17.51,0.41,2.398%,2011405656.00,United States,2013,867513,Consumer Services,Real Estate Investment Trusts
CXW,CoreCivic Inc. Common Stock,$8.84,-0.21,-2.32%,1057597569.00,United States,,1041615,Consumer Services,Real Estate Investment Trusts
CYD,China Yuchai International Limited Common Stock,$15.58,0.10,0.646%,636572158.00,Singapore,1994,13384,Energy,Industrial Machinery/Components
CYH,Community Health Systems Inc. Common Stock,$13.63,0.11,0.814%,1766652491.00,United States,2000,4865451,Health Care,Hospital/Nursing Management
D,Dominion Energy Inc. Common Stock,$75.72,-0.24,-0.316%,61030546024.00,United States,,2630683,Public Utilities,Electric Utilities: Central
DAC,Danaos Corporation Common Stock,$50.97,1.36,2.741%,1047908897.00,Greece,2006,508607,Transportation,Marine Transportation
DAL,Delta Air Lines Inc. Common Stock,$48.83,0.55,1.139%,31160701652.00,United States,,9564348,Transportation,Air Freight/Delivery Services
DAN,Dana Incorporated Common Stock ,$24.57,0.24,0.986%,3564247075.00,United States,,1255741,Capital Goods,Auto Parts:O.E.M.
DAO,Youdao Inc. American Depositary Shares each representing one Class A Ordinary Share,$25.98,2.16,9.068%,3221025237.00,,2019,446798,Consumer Services,Other Consumer Services
DAR,Darling Ingredients Inc. Common Stock,$73.40,-0.18,-0.245%,11975327660.00,United States,,1078203,Consumer Non-Durables,Packaged Foods
DASH,DoorDash Inc. Class A Common Stock,$133.14,2.01,1.533%,42799682344.00,,2020,2190526,Miscellaneous,Business Services
DAVA,Endava plc American Depositary Shares (each representing one Class A Ordinary Share),$84.34,-0.35,-0.413%,4648596877.00,,2018,102364,Technology,EDP Services
DB,Deutsche Bank AG Common Stock,$12.12,0.12,1.00%,25021414348.00,Germany,,2568640,Finance,Major Banks
DBD,Diebold Nixdorf Incorporated Common Stock,$14.19,0.06,0.425%,1109351354.00,United States,,332911,Miscellaneous,Office Equipment/Supplies/Services
DBI,Designer Brands Inc. Class A Common Stock,$16.98,-0.42,-2.414%,1229386775.00,United States,,1133663,Consumer Services,Clothing/Shoe/Accessory Stores
DBL,DoubleLine Opportunistic Credit Fund Common Shares of Beneficial Interest,$19.73,-0.01,-0.051%,295099558.00,United States,2012,45130,,
DCF,BNY Mellon Alcentra Global Credit Income 2024 Target Term Fund Inc. Common Stock,$9.31,-0.07,-0.746%,139306759.00,,2017,50474,,
DCI,Donaldson Company Inc. Common Stock,$58.93,0.77,1.324%,7432460566.00,United States,,354639,Capital Goods,Pollution Control Equipment
DCO,Ducommun Incorporated Common Stock,$62.25,2.25,3.75%,736608234.00,United States,,76038,Capital Goods,Military/Government/Technical
DCP,DCP Midstream  LP Common Units ,$22.21,0.55,2.539%,4627682507.00,United States,,726885,Public Utilities,Natural Gas Distribution
DCP^B,DCP Midstream LP 7.875% Series B Fixed-to-Floating Rate Cumulative Redeemable Perpetual Preferred Units,$24.55,-0.04,-0.163%,,United States,,49871,,
DCP^C,DCP Midstream LP 7.95% Series C Fixed-to-Floating Rate Cumulative Redeemable Perpetual Preferred Units,$24.201,0.221,0.922%,,United States,,8252,,
DCUE,Dominion Energy Inc. 2019 Series A Corporate Units,$99.36,0.52,0.526%,0.00,United States,2019,24452,Public Utilities,Electric Utilities: Central
DD,DuPont de Nemours Inc. Common Stock,$78.13,0.85,1.10%,41762458720.00,,2017,2263323,Basic Industries,Major Chemicals
DDD,3D Systems Corporation Common Stock,$27.05,-0.39,-1.421%,3357676168.00,United States,,2868107,Technology,Computer Software: Prepackaged Software
DDF,Delaware Investments Dividend & Income Fund Inc. Common Stock,$10.38,-0.02,-0.192%,79003830.00,United States,1993,22059,,
DDS,Dillard's Inc. Common Stock,$92.50,-4.07,-4.215%,2238500000.00,United States,,219924,Consumer Services,Department/Specialty Retail Stores
DDT,Dillard's Capital Trust I,$25.59,0.24,0.947%,0.00,United States,,30745,Consumer Services,Department/Specialty Retail Stores
DE,Deere & Company Common Stock,$372.12,-2.02,-0.54%,116636892027.00,United States,,1561945,Capital Goods,Industrial Machinery/Components
DEA,Easterly Government Properties Inc. Common Stock,$20.84,0.11,0.531%,1711563275.00,United States,2015,1008607,Consumer Services,Real Estate Investment Trusts
DECK,Deckers Outdoor Corporation Common Stock,$330.52,0.10,0.03%,9310721958.00,United States,1993,279559,Consumer Non-Durables,Shoe Manufacturing
DEH,D8 Holdings Corp. Class A Ordinary Shares,$9.91,-0.03,-0.302%,427368750.00,Hong Kong,2020,150258,Finance,Business Services
DEI,Douglas Emmett Inc. Common Stock,$32.28,0.88,2.803%,5663982697.00,United States,2006,964458,Consumer Services,Real Estate Investment Trusts
DELL,Dell Technologies Inc. Class C Common Stock ,$89.08,0.93,1.055%,67938411101.00,,2018,1928921,Technology,Computer Manufacturing
DEN,Denbury Inc. Common Stock,$50.87,2.98,6.223%,2543499949.00,,2020,1568191,Energy,Oil & Gas Production
DEO,Diageo plc Common Stock,$167.44,3.23,1.967%,97945112676.00,United Kingdom,,411208,Consumer Non-Durables,Beverages (Production/Distribution)
DESP,Despegar.com Corp. Ordinary Shares,$14.25,0.62,4.549%,996730500.00,,2017,635328,Consumer Services,Transportation Services
DEX,Delaware Enhanced Global Dividend Common Shares of Beneficial Interest,$9.83,0.02,0.204%,116962245.00,United States,2007,30998,,
DFIN,Donnelley Financial Solutions Inc. Common Stock ,$29.03,1.20,4.312%,966504180.00,,2016,216498,Consumer Services,Other Consumer Services
DFNS,LGL Systems Acquisition Corp. Common Stock,$9.94,0.00,0.00%,214331250.00,United States,2020,41538,Finance,Business Services
DFP,Flaherty & Crumrine Dynamic Preferred and Income Fund Inc. Common Stock,$30.25,0.13,0.432%,580528567.00,,2013,39843,,
DFS,Discover Financial Services Common Stock,$97.20,2.21,2.327%,29776731084.00,United States,,1593131,Finance,Finance: Consumer Services
DG,Dollar General Corporation Common Stock,$202.40,-0.22,-0.109%,48427084605.00,United States,2009,2105002,Consumer Services,Department/Specialty Retail Stores
DGNR,Dragoneer Growth Opportunities Corp. Class A Ordinary Shares,$10.24,0.09,0.887%,883200000.00,United States,2020,162388,Technology,Computer Software: Prepackaged Software
DGX,Quest Diagnostics Incorporated Common Stock,$129.44,1.10,0.857%,17274384264.00,United States,,1048518,Health Care,Medical Specialities
DHF,BNY Mellon High Yield Strategies Fund Common Stock,$3.11,0.02,0.647%,226120910.00,United States,1998,1224827,,
DHI,D.R. Horton Inc. Common Stock,$91.05,1.93,2.166%,33115040878.00,United States,,2443069,Capital Goods,Homebuilding
DHR,Danaher Corporation Common Stock,$225.08,0.00,0.00%,160497229074.00,United States,,1744413,Capital Goods,Industrial Machinery/Components
DHR^A,Danaher Corporation 4.75% Mandatory Convertible Preferred Stock Series A,$1530.11,0.00,0.00%,,United States,,3059,,
DHR^B,Danaher Corporation 5.00% Mandatory Convertible Preferred Stock Series B,$1300.40,5.20,0.401%,,United States,,6109,,
DHT,DHT Holdings Inc.,$6.05,0.12,2.024%,1037568974.00,Jersey,2005,2296665,Transportation,Marine Transportation
DHX,DHI Group Inc. Common Stock,$3.41,0.06,1.791%,178470336.00,United States,2007,202381,Miscellaneous,Business Services
DIAX,Nuveen Dow 30SM Dynamic Overwrite Fund Common Shares of Beneficial Interest,$16.30,0.05,0.308%,592780698.00,,2014,120845,,
DIN,Dine Brands Global Inc. Common Stock,$91.35,1.32,1.466%,1520531255.00,United States,,276193,Consumer Services,Restaurants
DIS,Walt Disney Company (The) Common Stock,$188.97,4.45,2.412%,343030418994.00,United States,,7735647,Consumer Services,Services-Misc. Amusement & Recreation
DK,Delek US Holdings Inc. Common Stock,$23.37,1.59,7.30%,1726463354.00,United States,2017,758991,Energy,Integrated oil Companies
DKL,Delek Logistics Partners L.P. Common Units representing Limited Partner Interests,$36.97,0.98,2.723%,1606100132.00,United States,2012,30616,Energy,Natural Gas Distribution
DKS,Dick's Sporting Goods Inc Common Stock,$79.27,3.12,4.097%,7077329919.00,United States,2002,2244659,Consumer Services,Other Specialty Stores
DLB,Dolby Laboratories Common Stock,$102.00,3.28,3.323%,10364522226.00,United States,2005,573572,Miscellaneous,Multi-Sector Companies
DLNG,Dynagas LNG Partners LP Common Units,$2.84,-0.02,-0.699%,101139727.00,Greece,,34140,Consumer Services,Marine Transportation
DLNG^A,Dynagas LNG Partners LP 9.00% Series A Cumulative Redeemable Preferred Units,$25.54,0.08,0.314%,,Greece,,3888,,
DLNG^B,Dynagas LNG Partners LP 8.75% Series B Fixed to Floating Rate Cumulative Redeemable Perpetual Preferred Units liquidation preference $25.00 per Uni,$22.60,0.27,1.209%,,Greece,,9859,,
DLR,Digital Realty Trust Inc. Common Stock,$143.25,2.41,1.711%,40270592132.00,United States,2004,1334087,Consumer Services,Real Estate Investment Trusts
DLR^C,Digital Realty Trust Inc. 6.625% Series C Cumulative Redeemable Perpetual Preferred Stock,$25.35,0.00,0.00%,,United States,,27129,,
DLR^J,Digital Realty Trust Inc. 5.250% Series J Cumulative Redeemable Preferred Stock,$26.55,0.03,0.113%,,United States,,56629,,
DLR^K,Digital Realty Trust Inc. 5.850% Series K Cumulative Redeemable Preferred Stock par value $0.01 per share,$27.97,0.20,0.72%,,United States,,12821,,
DLR^L,Digital Realty Trust Inc. 5.200% Series L Cumulative Redeemable Preferred Stock,$26.98,0.33,1.238%,,United States,,16240,,
DLX,Deluxe Corporation Common Stock,$42.34,0.38,0.906%,1782525644.00,United States,,218212,Consumer Durables,Publishing
DLY,DoubleLine Yield Opportunities Fund Common Shares of Beneficial Interest,$19.32,0.18,0.94%,0.00,,2020,131787,,
DM,Desktop Metal Inc. Class A Common Stock,$15.36,0.46,3.087%,3754732769.00,,2019,2743355,Technology,Industrial Machinery/Components
DMB,BNY Mellon Municipal Bond Infrastructure Fund Inc. Common Stock,$14.22,0.11,0.78%,261471288.00,,2013,30640,,
DMO,Western Asset Mortgage Opportunity Fund Inc. Common Stock,$14.68,0.04,0.273%,161878034.00,United States,2010,38148,,
DMS,Digital Media Solutions Inc. Class A Ordinary Shares,$12.73,0.49,4.003%,759803582.00,United States,2018,140951,Miscellaneous,Business Services
DMYD,dMY Technology Group Inc. II Class A Common Stock,$15.63,0.92,6.254%,539235000.00,United States,2020,1247440,Finance,Business Services
DMYI,dMY Technology Group Inc. III Class A Common Stock,$10.57,-0.20,-1.857%,396375000.00,United States,2021,478398,Finance,Business Services
DNB,Dun & Bradstreet Holdings Inc. Common Stock,$23.44,-0.37,-1.554%,10066054707.00,United States,2020,1888421,Finance,Finance: Consumer Services
DNMR,Danimer Scientific Inc. Common Stock,$37.52,-0.23,-0.609%,3302033033.00,,2020,1346466,Basic Industries,Major Chemicals
DNOW,NOW Inc. Common Stock,$10.47,0.38,3.766%,1145204695.00,,2014,453624,Energy,Metal Fabrications
DNP,DNP Select Income Fund Inc. Common Stock,$9.87,-0.01,-0.101%,3052816159.00,United States,1987,789126,,
DNZ,D and Z Media Acquisition Corp. Class A Common Stock,$9.70,0.03,0.31%,348593750.00,,2021,15353,Finance,Business Services
DOC,Physicians Realty Trust Common Shares of Beneficial Interest,$18.28,0.61,3.452%,3853885899.00,United States,2013,3193402,Consumer Services,Real Estate Investment Trusts
DOCN,DigitalOcean Holdings Inc. Common Stock,$43.80,1.67,3.964%,4612286292.00,,2021,687211,Technology,Computer Software: Programming Data Processing
DOOR,Masonite International Corporation Ordinary Shares (Canada),$119.92,4.68,4.061%,2942874695.00,Canada,,91929,Basic Industries,Forest Products
DOV,Dover Corporation Common Stock,$137.93,0.80,0.583%,19842148148.00,United States,,498415,Technology,Industrial Machinery/Components
DOW,Dow Inc. Common Stock ,$64.60,0.66,1.032%,48141525827.00,,2019,3698223,Basic Industries,Major Chemicals
DPG,Duff & Phelps Utility and Infrastructure Fund Inc.,$13.42,0.14,1.054%,509017997.00,United States,2011,245048,,
DPZ,Domino's Pizza Inc Common Stock,$373.38,5.59,1.52%,14487306794.00,United States,2004,567617,Consumer Non-Durables,Food Distributors
DQ,DAQO New Energy Corp. American Depositary Shares each representing five ordinary shares,$75.19,-0.31,-0.411%,5224489178.00,China,2010,1885247,Technology,Semiconductors
DRD,DRDGOLD Limited American Depositary Shares,$9.76,0.30,3.171%,834591059.00,South Africa,,217323,Basic Industries,Precious Metals
DRE,Duke Realty Corporation Common Stock,$42.86,0.93,2.218%,16019624990.00,United States,,1885092,Consumer Services,Real Estate Investment Trusts
DRH,Diamondrock Hospitality Company Common Stock,$10.50,0.20,1.942%,2222636262.00,United States,2005,1207614,Consumer Services,Real Estate Investment Trusts
DRH^A,Diamondrock Hospitality Company 8.250% Series A Cumulative Redeemable Preferred Stock,$27.99,-0.09,-0.321%,,United States,,20942,,
DRI,Darden Restaurants Inc. Common Stock,$144.28,2.28,1.606%,18803747935.00,United States,,1695488,Consumer Services,Restaurants
DRQ,Dril-Quip Inc. Common Stock,$33.77,0.54,1.625%,1196429833.00,United States,1997,177822,Energy,Metal Fabrications
DRUA,Dominion Energy Inc. 2016 Series A 5.25% Enhanced Junior Subordinated Notes due 2076,$25.70,0.15,0.587%,0.00,United States,2016,57169,Public Utilities,Electric Utilities: Central
DS,Drive Shack Inc.,$3.39,0.18,5.607%,309477354.00,United States,,2339296,Consumer Services,Restaurants
DS^B,Drive Shack Inc. Preferred Series B,$24.745,0.195,0.794%,,United States,,4864,,
DS^C,Drive Shack Inc. Preferred Series C,$23.02,-0.48,-2.043%,,United States,,1641,,
DS^D,Drive Shack Inc. Pfd Ser D,$22.77,-0.08,-0.35%,,United States,,1025,,
DSE,Duff & Phelps Select MLP and Midstream Energy Fund Inc.,$7.44,0.09,1.224%,19517761.00,United States,2014,24015,,
DSL,DoubleLine Income Solutions Fund Common Shares of Beneficial Interests,$18.18,0.02,0.11%,1853576587.00,,2013,286054,,
DSM,BNY Mellon Strategic Municipal Bond Fund Inc. Common Stock,$7.91,0.08,1.022%,390924152.00,United States,1989,87747,,
DSSI,Diamond S Shipping Inc. Common Stock ,$10.27,0.24,2.393%,415315452.00,,2019,1231012,Consumer Services,Transportation Services
DSU,Blackrock Debt Strategies Fund Inc. Common Stock,$11.02,0.02,0.182%,513441713.00,United States,1998,146825,,
DSX,Diana Shipping inc. common stock,$3.07,0.08,2.676%,281012456.00,Greece,2005,465098,Transportation,Marine Transportation
DSX^B,Diana Shipping Inc. Perpetual Preferred Shares Series B (Marshall Islands),$26.115,-0.04,-0.153%,,Greece,,6766,,
DT,Dynatrace Inc. Common Stock,$49.55,1.31,2.716%,14002522939.00,United States,2019,1651759,Technology,Computer Software: Prepackaged Software
DTB,DTE Energy Company 2020 Series G 4.375% Junior Subordinated Debentures due 2080,$25.08,-0.05,-0.199%,0.00,United States,2020,76790,Public Utilities,Electric Utilities: Central
DTE,DTE Energy Company Common Stock,$133.03,-0.11,-0.083%,25771530879.00,United States,,736941,Public Utilities,Electric Utilities: Central
DTF,DTF Tax-Free Income Inc. Common Stock,$14.40,0.05,0.348%,101225750.00,United States,1991,14225,,
DTJ,DTE Energy Company 2016 Series B 5.375% Junior Subordinated Debentures due 2076,$25.52,0.03,0.118%,0.00,United States,2016,14754,Public Utilities,Electric Utilities: Central
DTLA^,Brookfield DTLA Inc. 7.625% Series A Cumulative Redeemable Preferred Stock,$15.27,0.42,2.828%,,,,7086,,
DTP,DTE Energy Company 6.25% Corporate Units,$49.99,0.30,0.604%,0.00,United States,,49866,Public Utilities,Electric Utilities: Central
DTW,DTE Energy Company 2017 Series E 5.25% Junior Subordinated Debentures due 2077,$26.20,0.11,0.422%,0.00,United States,2017,99910,Public Utilities,Electric Utilities: Central
DTY,DTE Energy Company 2016 Series F 6.00% Junior Subordinated Debentures due 2076,$25.98,0.07,0.27%,0.00,United States,2016,24136,Public Utilities,Electric Utilities: Central
DUK,Duke Energy Corporation (Holding Company) Common Stock,$96.28,-0.25,-0.259%,74060166353.00,United States,,2876052,Public Utilities,Power Generation
DUK^A,Duke Energy Corporation Depositary Shares each representing a 1/1000th interest in a share of 5.75% Series A Cumulative Redeemable Perpetual Preferred Stock,$27.77,0.12,0.434%,,United States,,85815,Public Utilities,Power Generation
DUKB,Duke Energy Corporation 5.625% Junior Subordinated Debentures due 2078,$26.90,0.06,0.224%,0.00,United States,2018,271614,Public Utilities,Power Generation
DUKH,Duke Energy Corporation 5.125% Junior Subordinated Debentures due 2073,$26.18,0.28,1.081%,0.00,United States,,34282,Public Utilities,Power Generation
DVA,DaVita Inc. Common Stock,$105.44,-2.33,-2.162%,11479252800.00,United States,,1069076,Health Care,Misc Health and Biotechnology Services
DVD,Dover Motorsports Inc. Common Stock,$2.09,0.03,1.456%,76204725.00,United States,1996,38552,Consumer Services,Services-Misc. Amusement & Recreation
DVN,Devon Energy Corporation Common Stock,$23.50,1.65,7.551%,15817850000.00,United States,,14126876,Energy,Oil & Gas Production
DWIN,Delwinds Insurance Acquisition Corp. Class A Common Stock,$9.78,0.08,0.825%,252213975.00,,2021,21379,Finance,Business Services
DX,Dynex Capital Inc. Common Stock,$19.02,0.09,0.475%,577343902.00,United States,,470112,Consumer Services,Real Estate Investment Trusts
DX^C,Dynex Capital Inc. 6.900% Series C Fixed-to-Floating Rate Cumulative Redeemable Preferred Stock,$25.43,-0.12,-0.47%,,United States,,7609,,
DXC,DXC Technology Company Common Stock ,$30.83,-0.43,-1.376%,7849132804.00,,,2241327,Technology,EDP Services
DY,Dycom Industries Inc. Common Stock,$92.75,-0.10,-0.108%,2839625467.00,United States,,409922,Basic Industries,Water Supply
DYFN,Angel Oak Dynamic Financial Strategies Income Term Trust Common Shares of Beneficial Interest,$18.965,0.115,0.61%,0.00,,2020,18124,,
E,ENI S.p.A. Common Stock,$25.05,0.34,1.376%,44388088579.00,Italy,,240784,Energy,Oil & Gas Production
EAF,GrafTech International Ltd. Common Stock,$12.51,0.28,2.289%,3343112077.00,United States,2018,2024171,Energy,Industrial Machinery/Components
EAI,Entergy Arkansas LLC First Mortgage Bonds 4.875% Series Due September 1 2066,$25.50,0.08,0.315%,0.00,United States,2016,43866,Public Utilities,Electric Utilities: Central
EARN,Ellington Residential Mortgage REIT Common Shares of Beneficial Interest,$12.33,0.02,0.162%,152195873.00,United States,2013,57201,Consumer Services,Real Estate Investment Trusts
EAT,Brinker International Inc. Common Stock,$71.91,0.85,1.196%,3269035575.00,United States,,482117,Consumer Services,Restaurants
EB,Eventbrite Inc. Class A Common Stock,$23.15,0.99,4.468%,2152086111.00,United States,2018,1128245,Technology,Computer Software: Programming Data Processing
EBF,Ennis Inc. Common Stock,$21.43,0.08,0.375%,558670306.00,United States,,81533,Consumer Services,Office Equipment/Supplies/Services
EBR,Centrais Electricas Brasileiras S A American Depositary Shares (Each representing one Common Share),$5.97,-0.13,-2.131%,9366517533.00,,2016,608112,Public Utilities,Electric Utilities: Central
EBS,Emergent Biosolutions Inc. Common Stock,$80.46,-12.45,-13.40%,4288518000.00,United States,2006,3190833,Health Care,Major Pharmaceuticals
EC,Ecopetrol S.A. American Depositary Shares,$12.83,0.01,0.078%,26376359637.00,Colombia,,1052379,Energy,Oil & Gas Production
ECC           ,Eagle Point Credit Company Inc. Common Stock,$12.23,0.25,2.087%,395700305.00,United States,2014,118073,,
ECCB,Eagle Point Credit Company Inc. 7.75% Series B Term Preferred Stock due 2026,$25.80,0.12,0.467%,0.00,United States,2016,17080,,
ECCW,Eagle Point Credit Company Inc. 6.75% Notes due 2031,$25.11,0.17,0.682%,0.00,United States,2021,99036,,
ECCX,Eagle Point Credit Company Inc. 6.6875% Notes due 2028,$25.30,0.1332,0.529%,0.00,United States,2018,5517,,
ECCY,Eagle Point Credit Company Inc. 6.75% Notes due 2027,$25.34,0.03,0.119%,0.00,United States,2017,686,,
ECL,Ecolab Inc. Common Stock,$216.85,2.78,1.299%,62036039021.00,United States,,701955,Basic Industries,Package Goods/Cosmetics
ECOM          ,ChannelAdvisor Corporation Common Stock,$24.45,0.90,3.822%,726546469.00,United States,2013,211086,Technology,Computer Software: Prepackaged Software
ED,Consolidated Edison Inc. Common Stock,$74.29,-0.51,-0.682%,25438319545.00,United States,,2038216,Public Utilities,Power Generation
EDD,Morgan Stanley Emerging Markets Domestic Debt Fund Inc. Morgan Stanley Emerging Markets Domestic Debt Fund Inc. Common Stock,$6.02,0.00,0.00%,397874593.00,United States,2007,175720,,
EDF,Stone Harbor Emerging Markets Income Fund Common Shares of Beneficial Interest,$8.62,0.20,2.375%,143745999.00,United States,2010,76856,,
EDI,Stone Harbor Emerging Markets Total Income Fund Common Shares of Beneficial Interests,$9.14,0.06,0.661%,90286364.00,United States,2012,18374,,
EDN,Empresa Distribuidora Y Comercializadora Norte S.A. (Edenor) Empresa Distribuidora Y Comercializadora Norte S.A. (Edenor) American Depositary Shares,$3.54,-0.04,-1.117%,154888137.00,Argentina,2007,9893,Public Utilities,Electric Utilities: Central
EDU,New Oriental Education & Technology Group Inc. Sponsored ADR representing 1 Ordinary Share (Cayman Islands),$14.50,0.50,3.571%,24674053615.00,China,2006,10817559,Consumer Services,Other Consumer Services
EEA,The European Equity Fund Inc. Common Stock,$10.75,0.0956,0.897%,77514939.00,United States,,7401,,
EEX,Emerald Holding Inc. Common Stock,$5.71,0.19,3.442%,413251143.00,United States,2017,198561,Miscellaneous,Business Services
EFC,Ellington Financial Inc. Common Stock ,$16.31,0.30,1.874%,714079266.00,United States,2010,160718,Finance,Real Estate
EFC^A,Ellington Financial Inc. 6.750% Series A Fixed-to-Floating Rate Cumulative Redeemable Preferred Stock,$25.875,0.075,0.291%,,United States,,18896,,
EFF,Eaton vance Floating-Rate Income Plus Fund Common Shares of Beneficial Interest,$16.24,-0.04,-0.246%,123528293.00,,2013,62838,,
EFL,Eaton Vance Floating-Rate 2022 Target Term Trust Common Shares of Beneficial Interest,$9.44,0.03,0.319%,222988017.00,United States,2017,23753,,
EFR,Eaton Vance Senior Floating-Rate Fund Common Shares of Beneficial Interest,$13.86,0.07,0.508%,510717618.00,United States,2003,334540,,
EFT,Eaton Vance Floating Rate Income Trust Common Shares of Beneficial Interest,$14.11,0.01,0.071%,562476666.00,United States,2004,114341,,
EFX,Equifax Inc. Common Stock,$182.61,1.48,0.817%,22355713517.00,United States,,575670,Finance,Finance: Consumer Services
EGF,Blackrock Enhanced Government Fund Inc. Common Stock,$12.70,-0.06,-0.47%,54124555.00,United States,2005,3948,,
EGHT,8x8 Inc Common Stock,$32.92,0.48,1.48%,3538451432.00,United States,,845858,Technology,EDP Services
EGO,Eldorado Gold Corporation Ordinary Shares,$11.32,0.53,4.912%,1980223233.00,Canada,,3259254,Basic Industries,Precious Metals
EGP,EastGroup Properties Inc. Common Stock,$147.80,4.52,3.155%,5861689323.00,United States,,192375,Consumer Services,Real Estate Investment Trusts
EGY,VAALCO Energy Inc.  Common Stock,$2.33,0.09,4.018%,134355228.00,United States,,271728,Energy,Oil & Gas Production
EHC,Encompass Health Corporation Common Stock,$82.57,0.67,0.818%,8196369344.00,United States,,415743,Health Care,Hospital/Nursing Management
EHI,Western Asset Global High Income Fund Inc Common Stock,$10.38,-0.12,-1.143%,235597943.00,United States,2003,90803,,
EHT,Eaton Vance 2021 Target Term Trust Common Shares of Beneficial Interest,$9.8501,0.0201,0.204%,211427511.00,United States,2016,47313,,
EIC,Eagle Point Income Company Inc. Common Stock,$15.289,0.049,0.322%,0.00,,2019,3042,,
EIG,Employers Holdings Inc Common Stock,$42.05,-1.01,-2.346%,1189059834.00,United States,2007,188095,Finance,Property-Casualty Insurers
EIX,Edison International Common Stock,$58.29,-0.31,-0.529%,22111238673.00,United States,,3226003,Public Utilities,Electric Utilities: Central
EL,Estee Lauder Companies Inc. (The) Common Stock,$292.33,1.48,0.509%,106045483466.00,United States,1995,965364,Consumer Non-Durables,Package Goods/Cosmetics
ELAN,Elanco Animal Health Incorporated Common Stock,$28.79,-0.66,-2.241%,13611904572.00,United States,2018,3755731,Health Care,Major Pharmaceuticals
ELAT,Elanco Animal Health Incorporated 5.00% Tangible Equity Units,$44.90,-0.98,-2.136%,0.00,United States,2020,24314,Health Care,Major Pharmaceuticals
ELC,Entergy Louisiana Inc. Collateral Trust Mortgage Bonds 4.875 % Series due September 1 2066,$25.52,0.07,0.275%,0.00,United States,2016,24453,Public Utilities,Electric Utilities: Central
