Symbol,Name,Last Sale,Net Change,% Change,Market Cap,Country,IPO Year,Volume,Sector,Industry
JBT,John Bean Technologies Corporation Common Stock,$135.90,2.56,1.92%,4312071122.00,United States,,150499,Technology,Industrial Machinery/Components
JCE,Nuveen Core Equity Alpha Fund Nuveen Core Equity Alpha Fund Common Shares of Beneficial Interest,$15.08,-0.13,-0.855%,241721557.00,United States,2007,83552,,
JCI,Johnson Controls International plc Ordinary Share,$59.90,0.23,0.385%,43030441349.00,Switzerland,,3049011,Consumer Services,Other Consumer Services
JCO,Nuveen Credit Opportunities 2022 Target Term Fund Common Shares of Beneficial Interest,$8.41,0.02,0.238%,233381638.00,United States,2017,55481,,
JDD,Nuveen Diversified Dividend and Income Fund Shares of Beneficial Interest,$9.41,-0.07,-0.738%,185080745.00,United States,2003,91478,,
JEF,Jefferies Financial Group Inc. Common Stock,$30.39,0.29,0.963%,7497304170.00,United States,,2728022,Finance,Investment Bankers/Brokers/Service
JELD,JELD-WEN Holding Inc. Common Stock,$28.37,0.68,2.456%,2838017093.00,United States,2017,273579,Basic Industries,Forest Products
JEMD,Nuveen Emerging Markets Debt 2022 Target Term Fund Common Shares of Beneficial Interest $0.01 par value per share,$7.93,0.03,0.38%,112978647.00,,2017,13616,,
JEQ,Aberdeen Japan Equity Fund Inc.  Common Stock,$9.10,0.08,0.887%,122017678.00,United States,1992,41386,,
JFR,Nuveen Floating Rate Income Fund Common Stock,$9.72,0.06,0.621%,553247509.00,United States,2004,834146,,
JGH,Nuveen Global High Income Fund Common Shares of Beneficial Interest,$15.53,0.06,0.388%,359944913.00,United States,2014,57149,,
JHAA,Nuveen Corporate Income 2023 Target Term Fund,$9.89,-0.06,-0.603%,77393790.00,,2018,16049,,
JHB,Nuveen Corporate Income November 2021 Target Term Fund,$9.40,0.03,0.32%,525460461.00,,2016,101978,,
JHG,Janus Henderson Group plc Ordinary Shares,$32.11,0.96,3.082%,5534158147.00,,2017,989291,Finance,Investment Managers
JHI,John Hancock Investors Trust Common Stock,$18.29,0.30,1.668%,159251487.00,United States,,25019,,
JHS,John Hancock Income Securities Trust Common Stock,$15.56,-0.05,-0.32%,181220847.00,United States,,19674,,
JHX,James Hardie Industries plc American Depositary Shares (Ireland),$31.88,1.30,4.251%,14160059549.00,Ireland,,27164,Capital Goods,Building Materials
JIH,Juniper Industrial Holdings Inc. Class A Common Stock,$12.84,0.44,3.548%,553725000.00,,2019,536855,Finance,Business Services
JILL,J. Jill Inc. Common Stock,$9.95,0.20,2.051%,95834748.00,,2017,376718,Consumer Non-Durables,Apparel
JKS,JinkoSolar Holding Company Limited American Depositary Shares (each representing 4 Common Shares),$42.55,0.86,2.063%,1927253275.00,China,2010,2172556,Technology,Semiconductors
JLL,Jones Lang LaSalle Incorporated Common Stock,$184.52,5.48,3.061%,9430959280.00,United States,,297708,Finance,Real Estate
JLS,Nuveen Mortgage and Income Fund,$20.73,-0.02,-0.096%,113754631.00,United States,2009,16395,,
JMIA,Jumia Technologies AG American Depositary Shares each representing two Ordinary Shares,$38.01,2.55,7.191%,3747504118.00,,2019,9837562,Consumer Services,Catalog/Specialty Distribution
JMM,Nuveen Multi-Market Income Fund (MA),$7.29,0.025,0.344%,68980539.00,United States,,3052,,
JMP,JMP Group LLC Common Shares,$6.08,0.10,1.672%,120525992.00,United States,2007,20958,Finance,Investment Bankers/Brokers/Service
JNJ,Johnson & Johnson Common Stock,$162.83,-1.52,-0.925%,428683610793.00,United States,,7226608,Health Care,Major Pharmaceuticals
JNPR,Juniper Networks Inc. Common Stock,$25.62,0.29,1.145%,8407769176.00,United States,1999,3153015,Technology,Computer Communications Equipment
JOE,St. Joe Company (The) Common Stock,$44.09,1.19,2.774%,2596131585.00,United States,,213601,Consumer Services,Homebuilding
JOF,Japan Smaller Capitalization Fund Inc Common Stock,$9.34,0.04,0.43%,264638561.00,United States,1990,27223,,
JP,Jupai Holdings Limited American Depositary Shares each representing six ordinary shares,$2.24,0.02,0.901%,75520070.00,,2015,30926,Consumer Services,Other Consumer Services
JPC,Nuveen Preferred & Income Opportunities Fund,$9.49,0.00,0.00%,980840364.00,United States,2003,357173,,
JPI,Nuveen Preferred and Income Term Fund Common Shares of Beneficial Interest,$25.11,0.10,0.40%,571538528.00,,2012,48312,,
JPM,JP Morgan Chase & Co. Common Stock,$153.71,1.48,0.972%,469047054278.00,United States,,16556048,Finance,Major Banks
JPM^C,J P Morgan Chase & Co Depositary Shares each representing a 1/400th interest in a share of 6.00% Non-Cumulative  Preferred Stock Series EE,$27.60,0.12,0.437%,,United States,,123027,,
JPM^D,J P Morgan Chase & Co Depositary Shares each representing a 1/400th  interest in a share of 5.75% Non-Cumulative  Preferred Stock Series DD,$27.26,0.15,0.553%,,United States,,91576,,
JPM^G,J P Morgan Chase & Co Depositary Shares each representing a 1/400th interest in a share of 6.10% Non-Cumulative Preferred Stock Series AA,$25.59,0.13,0.511%,,United States,,89544,,
JPM^H,J P Morgan Chase & Co Depositary Shares each representing a 1/400th interest in a share of 6.15% Non-Cumulative Preferred Stock Series BB,$25.70,0.18,0.705%,,United States,,85638,Finance,Major Banks
JPM^J,J P Morgan Chase & Co Depositary Shares each representing a 1/400th interest in a share of JPMorgan Chase & Co. 4.75% Non-Cumulative Preferred Stock Series GG,$26.69,0.27,1.022%,,United States,,63636,Finance,Major Banks
JPM^K,J P Morgan Chase & Co Depositary Shares each representing a 1/400th interest in a share of 4.55% Non-Cumulative Preferred Stock Series JJ,$25.59,-0.03,-0.117%,,United States,,719062,,
JPS,Nuveen Preferred & Income Securities Fund,$9.70,-0.02,-0.206%,1976764426.00,United States,2002,543374,,
JPT,Nuveen Preferred and Income 2022 Term Fund Common Shares of Beneficial Interest,$24.3613,-0.1287,-0.526%,166657407.00,United States,2017,7380,,
JQC,Nuveen Credit Strategies Income Fund Shares of Beneficial Interest,$6.55,0.05,0.769%,888240850.00,United States,2003,692754,,
JRI,Nuveen Real Asset Income and Growth Fund Common Shares of Beneficial Interest,$15.07,0.35,2.378%,413726958.00,United States,2012,282170,,
JRO,Nuveen Floating Rate Income Opportuntiy Fund Shares of Beneficial Interest,$9.58,0.04,0.419%,388384868.00,United States,2004,208128,,
JRS,Nuveen Real Estate Income Fund Common Shares of Beneficial Interest,$9.62,0.03,0.313%,277945571.00,United States,2001,124234,,
JSD,Nuveen Short Duration Credit Opportunities Fund Common Shares of Beneficial Interest,$14.16,0.04,0.283%,142812776.00,United States,2011,37097,,
JT,Jianpu Technology Inc. American depositary shares,$2.58,-0.02,-0.769%,54526200.00,,2017,105392,Technology,Computer Software: Programming Data Processing
JTA,Nuveen Tax-Advantaged Total Return Strategy Fund Common Share of Beneficial Interest,$10.72,-0.02,-0.186%,148481616.00,United States,2004,99227,,
JTD,Nuveen Tax-Advantaged Dividend Growth Fund Common Shares of Beneficial Interest,$15.08,-0.03,-0.199%,218423847.00,United States,,68355,,
JW/A,John Wiley & Sons Inc.,$55.50,1.30,2.399%,,United States,,326320,,
JW/B,John Wiley & Sons Inc.,$55.19,1.94,3.643%,,United States,,471,,
JWN,Nordstrom Inc. Common Stock,$36.76,-1.11,-2.931%,5799639169.00,United States,,3755690,Consumer Services,Clothing/Shoe/Accessory Stores
JWS,Jaws Acquisition Corp. Class A Ordinary Shares,$13.42,0.17,1.283%,1157475000.00,,2020,352191,Health Care,Medical/Nursing Services
JWSM,Jaws Mustang Acquisition Corp. Class A Ordinary Shares,$9.90,0.02,0.202%,0.00,,2021,28806,Finance,Business Services
K,Kellogg Company Common Stock,$63.34,0.04,0.063%,21558111036.00,United States,,3652905,Consumer Non-Durables,Packaged Foods
KAI,Kadant Inc Common Stock,$186.94,1.93,1.043%,2157706346.00,United States,,30743,Technology,Industrial Machinery/Components
KAMN,Kaman Corporation Common Stock,$51.71,0.42,0.819%,1433977973.00,United States,,114597,Capital Goods,Military/Government/Technical
KAR,KAR Auction Services Inc Common Stock,$15.26,0.26,1.733%,1979252581.00,United States,2009,1556715,Consumer Durables,Automotive Aftermarket
KB,KB Financial Group Inc,$48.33,-1.10,-2.225%,19072677411.00,South Korea,,285631,Finance,Commercial Banks
KBH,KB Home Common Stock,$47.78,1.25,2.686%,4723087641.00,United States,1986,1034661,Capital Goods,Homebuilding
KBR,KBR Inc. Common Stock,$37.18,-1.21,-3.152%,5236571146.00,United States,2006,1947181,Basic Industries,Military/Government/Technical
KEN,Kenon Holdings Ltd. Ordinary Shares,$31.25,0.75,2.459%,1683473719.00,Singapore,2015,9121,Public Utilities,Electric Utilities: Central
KEP,Korea Electric Power Corporation Common Stock,$10.40,0.14,1.365%,13352852802.00,South Korea,1994,101336,Public Utilities,Electric Utilities: Central
KEX,Kirby Corporation Common Stock,$60.23,-0.05,-0.083%,3618983635.00,United States,,443355,Consumer Services,Marine Transportation
KEY,KeyCorp Common Stock,$20.27,0.29,1.451%,19460386038.00,United States,,9114016,Finance,Major Banks
KEY^I,KeyCorp Depositary Shares Each Representing a 1/40th Ownership Interest in a Share of Fixed-to-Floating Rate Perpetual Non-Cumulative Preferred Stock Series E,$30.00,0.22,0.739%,,United States,,37406,,
KEY^J,KeyCorp Depositary Shares each representing a 1/40th ownership interest in a share of Fixed Rate Perpetual Non-Cumulative Preferred Stock Series F,$27.34,0.26,0.96%,,United States,,30166,,
KEY^K,KeyCorp Depositary Shares each representing a 1/40th ownership interest in a share of Fixed Rate Perpetual Non-Cumulative Preferred Stock Series G,$28.05,0.17,0.61%,,United States,,26323,,
KEYS,Keysight Technologies Inc. Common Stock,$143.79,0.39,0.272%,26744139377.00,United States,2014,1024814,Capital Goods,Industrial Machinery/Components
KF,Korea Fund Inc. (The) New Common Stock,$43.90,0.51,1.175%,220376946.00,United States,,14947,,
KFS,Kingsway Financial Services Inc. Common Stock (DE),$4.60,-0.05,-1.075%,104470917.00,Canada,,13610,Finance,Property-Casualty Insurers
KFY,Korn Ferry Common Stock,$63.21,0.84,1.347%,3413767868.00,United States,1999,200705,Technology,Diversified Commercial Services
KGC,Kinross Gold Corporation Common Stock,$7.02,0.35,5.247%,8833968000.00,Canada,,18861288,Basic Industries,Precious Metals
KIM,Kimco Realty Corporation Common Stock,$19.20,0.45,2.40%,8322071462.00,United States,,3963021,Consumer Services,Real Estate Investment Trusts
KIM^L,Kimco Realty Corporation Class L Depositary Shares each of which represents a one-one thousandth fractional interest in a share of 5.125% Class L Cumulative Redeemable Preferred Stock liquidation preference $25000.00 per share,$26.37,0.08,0.304%,,United States,,42337,,
KIM^M,Kimco Realty Corporation Class M Depositary Shares each of which represents a one-one thousandth fractional interest in a share of 5.25% Class M Cumulative Redeemable Preferred Stock liquidation preference $25000.00 per share,$26.65,0.32,1.215%,,United States,,11697,,
KIO,KKR Income Opportunities Fund Common Shares,$15.82,0.00,0.00%,321783783.00,,2013,83410,,
KKR,KKR & Co. Inc. Common Stock,$50.35,1.50,3.071%,29032372611.00,United States,,2397407,Finance,Investment Managers
KKR^A,KKR & Co. Inc. 6.75% Series A Preferred Stock,$25.71,0.21,0.824%,,United States,,18935,,
KKR^B,KKR & Co. Inc. 6.50% Series B Preferred Stock,$25.71,0.04,0.156%,,United States,,5859,,
KKR^C,KKR & Co. Inc. 6.00% Series C Mandatory Convertible Preferred Stock,$68.60,1.95,2.926%,,United States,,23501,,
KL,Kirkland Lake Gold Ltd. Common Shares,$35.41,1.61,4.763%,9455311944.00,,,2103509,Basic Industries,Precious Metals
KMB,Kimberly-Clark Corporation Common Stock,$136.98,-2.07,-1.489%,46300159821.00,United States,,3235274,Consumer Durables,Containers/Packaging
KMF,Kayne Anderson NextGen Energy & Infrastructure Inc.,$6.75,0.09,1.351%,318582869.00,,2010,153551,,
KMI,Kinder Morgan Inc. Common Stock,$16.84,0.19,1.141%,38133341705.00,United States,2011,13315997,Public Utilities,Natural Gas Distribution
KMPR,Kemper Corporation,$81.14,1.42,1.781%,5322353796.00,United States,,273229,Finance,Property-Casualty Insurers
KMT,Kennametal Inc. Common Stock,$40.63,0.66,1.651%,3393945912.00,United States,,434305,Capital Goods,Industrial Machinery/Components
KMX,CarMax Inc,$123.31,-9.35,-7.048%,20042986323.00,United States,,4634494,Consumer Durables,Automotive Aftermarket
KN,Knowles Corporation Common Stock,$21.44,0.52,2.486%,1987346003.00,,2014,306172,Consumer Non-Durables,Consumer Electronics/Appliances
KNL,Knoll Inc. Common Stock,$16.56,0.05,0.303%,841353603.00,United States,2004,279776,Consumer Durables,Office Equipment/Supplies/Services
KNOP,KNOT Offshore Partners LP Common Units representing Limited Partner Interests,$18.15,0.34,1.909%,593397806.00,United Kingdom,2013,79129,Consumer Services,Marine Transportation
KNX,Knight-Swift Transportation Holdings Inc.,$48.76,0.67,1.393%,8077058551.00,United States,2017,1504146,Transportation,Trucking Freight/Courier Services
KO,Coca-Cola Company (The) Common Stock,$52.51,-0.20,-0.379%,226281956107.00,United States,,15831581,Consumer Non-Durables,Beverages (Production/Distribution)
KODK,Eastman Kodak Company Common New,$8.29,0.42,5.337%,650793816.00,United States,,4888995,Miscellaneous,Industrial Machinery/Components
KOF,Coca Cola Femsa S.A.B. de C.V.  American Depositary Shares each representing 10 Units (each Unit consists of 3 Series B Shares and 5 Series L Shares),$46.60,0.40,0.866%,9789902750.00,Mexico,1993,107729,Consumer Non-Durables,Beverages (Production/Distribution)
KOP,Koppers Holdings Inc. Koppers Holdings Inc. Common Stock,$34.63,-0.13,-0.374%,730642579.00,United States,2006,120817,Basic Industries,Forest Products
KOS,Kosmos Energy Ltd. Common Shares (DE),$3.25,0.18,5.863%,1325491450.00,Bermuda,2011,6855483,Energy,Oil & Gas Production
KR,Kroger Company (The) Common Stock,$35.95,-0.04,-0.111%,27214150000.00,United States,,11932293,Consumer Services,Food Chains
KRA,Kraton Corporation Common Stock,$37.31,0.72,1.968%,1189965998.00,United States,2009,262421,Basic Industries,Major Chemicals
KRC,Kilroy Realty Corporation Common Stock,$67.28,1.65,2.514%,7829312779.00,United States,1997,741357,Consumer Services,Real Estate Investment Trusts
KREF,KKR Real Estate Finance Trust Inc. Common Stock,$18.70,0.31,1.686%,1040083304.00,United States,2017,240958,Consumer Services,Real Estate Investment Trusts
KRG,Kite Realty Group Trust Common Stock,$19.79,0.50,2.592%,1668144023.00,United States,2004,627292,Consumer Services,Real Estate Investment Trusts
KRO,Kronos Worldwide Inc Common Stock,$15.44,0.14,0.915%,1783979550.00,United States,,115883,Basic Industries,Major Chemicals
KRP,Kimbell Royalty Partners Common Units Representing Limited Partner Interests,$10.20,0.06,0.592%,612838012.00,United States,2017,84592,Energy,Oil & Gas Production
KSM,DWS Strategic Municipal Income Trust,$11.85,0.02,0.169%,132766701.00,United States,1989,37053,,
KSS,Kohl's Corporation Common Stock,$58.31,-1.30,-2.181%,9189226663.00,United States,1992,3293628,Consumer Services,Department/Specialty Retail Stores
KSU,Kansas City Southern Common Stock,$266.98,3.06,1.159%,24278257740.00,United States,,1185154,Transportation,Railroads
KSU^,Kansas City Southern Preferred Stock,$37.90,1.00,2.71%,,United States,,522,Transportation,Railroads
KT,KT Corporation Common Stock,$12.48,0.04,0.322%,5935451658.00,South Korea,,675368,Public Utilities,Telecommunications Equipment
KTB,Kontoor Brands Inc. Common Stock ,$48.74,0.21,0.433%,2796313522.00,,2019,310721,Consumer Non-Durables,Apparel
KTF,DWS Municipal Income Trust,$11.72,0.07,0.601%,462950993.00,United States,1988,27096,,
KTH,Structures Products Cp 8% CorTS Issued by Peco Energy Cap Tr II Preferred Stock,$33.40,0.224,0.675%,0.00,United States,,354,Finance,Finance: Consumer Services
KTN,Structured Products Corp 8.205% CorTS 8.205% Corporate Backed Trust Securities (CorTS),$32.25,-0.115,-0.355%,0.00,United States,,4566,Finance,Finance: Consumer Services
KUKE,Kuke Music Holding Limited American Depositary Shares each representing one Ordinary Share,$7.03,0.18,2.628%,207854063.00,,2021,37567,Consumer Services,Other Consumer Services
KW,Kennedy-Wilson Holdings Inc. Common Stock,$20.50,0.29,1.435%,2892229934.00,United States,,384881,Finance,Real Estate
KWAC,Kingswood Acquisition Corp. Class A Common Stock,$9.98,0.042,0.423%,144500420.00,,2021,40845,Finance,Business Services
KWR,Quaker Chemical Corporation Common Stock,$244.39,0.62,0.254%,4363265743.00,United States,,132998,Basic Industries,Major Chemicals
KYN,Kayne Anderson Energy Infrastructure Fund Inc.,$7.39,0.22,3.068%,934447424.00,United States,2004,1430391,,
L,Loews Corporation Common Stock,$52.25,0.97,1.892%,13786687508.00,United States,,885862,Finance,Property-Casualty Insurers
LAC,Lithium Americas Corp. Common Shares,$15.87,-0.20,-1.245%,1895265783.00,Canada,,6835750,Basic Industries,Precious Metals
LAD,Lithia Motors Inc. Common Stock,$398.55,8.46,2.169%,10694043455.00,United States,,174623,Consumer Durables,Automotive Aftermarket
LADR,Ladder Capital Corp Class A Common Stock,$11.81,0.01,0.085%,1497812226.00,,2014,639141,Consumer Services,Real Estate Investment Trusts
LAIX,LAIX Inc. American Depositary Shares each  representing one Class A Ordinary Share,$2.44,-0.08,-3.175%,120565849.00,,2018,924995,Consumer Services,Other Consumer Services
LAZ,Lazard LTD. Lazard LTD. Class A Common Stock,$44.81,1.30,2.988%,4810062818.00,Bermuda,2005,321283,Finance,Investment Managers
LB,L Brands Inc.,$61.80,-0.06,-0.097%,17230732825.00,United States,,4289382,Consumer Services,Clothing/Shoe/Accessory Stores
LBRT,Liberty Oilfield Services Inc. Class A Common Stock,$11.70,0.41,3.632%,2100629174.00,United States,2018,695443,Energy,Oilfield Services/Equipment
LC,LendingClub Corporation Common Stock,$16.40,-0.12,-0.726%,1534223592.00,United States,2014,2483256,Finance,Finance: Consumer Services
LCI,Lannett Co Inc Common Stock,$5.74,0.46,8.712%,237645930.00,United States,,513634,Health Care,Major Pharmaceuticals
LCII,LCI Industries,$136.29,4.01,3.031%,3428929514.00,United States,,78397,Capital Goods,Auto Parts:O.E.M.
LDI,loanDepot Inc. Class A Common Stock,$20.06,0.12,0.602%,6125794757.00,,2021,295003,Finance,Finance: Consumer Services
LDL,Lydall Inc. Common Stock,$33.60,-0.14,-0.415%,605605627.00,United States,,73268,Capital Goods,Auto Parts:O.E.M.
LDOS,Leidos Holdings Inc. Common Stock,$96.45,0.17,0.177%,13632847356.00,United States,,605563,Technology,EDP Services
LDP,Cohen & Steers Limited Duration Preferred and Income Fund Inc.,$26.18,0.06,0.23%,757227466.00,United States,2012,51809,,
LEA,Lear Corporation Common Stock,$180.13,-1.12,-0.618%,10828517472.00,United States,,296822,Capital Goods,Auto Parts:O.E.M.
LEAF,Leaf Group Ltd. Common Stock,$7.03,0.58,8.992%,251678577.00,United States,,645668,Technology,EDP Services
LEAP,Ribbit LEAP Ltd. Class A Ordinary Shares,$11.14,0.14,1.273%,651745700.00,United States,2020,206797,Finance,Business Services
LEE,Lee Enterprises Incorporated Common Stock,$26.02,0.33,1.285%,152905307.00,United States,,35316,Consumer Services,Newspapers/Magazines
LEG,Leggett & Platt Incorporated Common Stock,$46.45,0.80,1.752%,6177265427.00,United States,,552505,Consumer Durables,Home Furnishings
LEJU,Leju Holdings Limited American Depositary Shares each representing one Ordinary share,$2.59,0.12,4.858%,353084392.00,,2014,50212,Finance,Real Estate
LEN,Lennar Corporation Class A Common Stock,$103.43,2.20,2.173%,32282230591.00,United States,,1780866,Basic Industries,Homebuilding
LEO,BNY Mellon Strategic Municipals Inc. Common Stock,$8.58,0.04,0.468%,533759758.00,United States,1987,70893,,
LEVI,Levi Strauss & Co Class A Common Stock,$23.69,-0.22,-0.92%,9471849370.00,United States,2019,564744,Consumer Non-Durables,Apparel
LFC,China Life Insurance Company Limited American Depositary Shares,$10.43,0.02,0.192%,58960174630.00,China,2003,366607,Finance,Life Insurance
LFT,Lument Finance Trust Inc. Common Stock,$3.52,-0.01,-0.283%,87800708.00,United States,2013,33426,Consumer Services,Real Estate Investment Trusts
LGI,Lazard Global Total Return and Income Fund Common Stock,$19.30,0.07,0.364%,251086457.00,United States,2004,35513,,
LH,Laboratory Corporation of America Holdings Common Stock,$252.70,-2.33,-0.914%,24663520000.00,United States,,710783,Health Care,Medical Specialities
LHC,Leo Holdings Corp. II Class A Ordinary Shares,$9.75,0.03,0.309%,463734375.00,,2021,1072,Finance,Business Services
LHX,L3Harris Technologies Inc. Common Stock,$203.62,0.94,0.464%,41857304531.00,United States,,996439,Capital Goods,Industrial Machinery/Components
LII,Lennox International Inc. Common Stock,$316.74,5.15,1.653%,11951729378.00,United States,1999,155181,Capital Goods,Industrial Machinery/Components
LIN,Linde plc Ordinary Share,$280.84,0.70,0.25%,146833381597.00,,2018,1594893,Basic Industries,Major Chemicals
LINX,Linx S.A. American Depositary Shares each representing one common share,$6.63,-0.01,-0.151%,1164846068.00,,2019,11093,Technology,Computer Software: Prepackaged Software
LITB,LightInTheBox Holding Co. Ltd. American Depositary Shares each representing 2 ordinary shares,$2.83,0.09,3.285%,316324880.00,China,2013,233646,Consumer Services,Catalog/Specialty Distribution
LL,Lumber Liquidators Holdings Inc Common Stock,$26.17,1.05,4.18%,756589852.00,United States,2007,336085,Consumer Services,RETAIL: Building Materials
LLY,Eli Lilly and Company Common Stock,$185.24,-1.58,-0.846%,177643707533.00,United States,,2338256,Health Care,Major Pharmaceuticals
LMND,Lemonade Inc. Common Stock,$95.58,2.45,2.631%,5857318363.00,United States,2020,1563960,Finance,Property-Casualty Insurers
LMT,Lockheed Martin Corporation Common Stock,$371.02,1.52,0.411%,103407800073.00,United States,,1261577,Capital Goods,Military/Government/Technical
LNC,Lincoln National Corporation Common Stock,$62.90,0.63,1.012%,12074175875.00,United States,,1125078,Finance,Life Insurance
LND,Brasilagro Brazilian Agric Real Estate Co Sponsored ADR (Brazil),$4.27,0.16,3.893%,338111090.00,Brazil,,19681,Consumer Non-Durables,Farming/Seeds/Milling
LNFA,L&amp;F Acquisition Corp. Class A Ordinary Shares,$9.94,0.09,0.914%,0.00,United States,2021,14296,Finance,Business Services
LNN,Lindsay Corporation Common Stock,$167.40,0.78,0.468%,1818842180.00,United States,,24797,Capital Goods,Industrial Machinery/Components
LOKB,Live Oak Acquisition Corp. II Class A Common Stock,$9.96,-0.03,-0.30%,314985000.00,,2021,121191,Finance,Business Services
LOMA,Loma Negra Compania Industrial Argentina Sociedad Anonima ADS,$6.34,0.01,0.158%,755728000.00,Argentina,2017,109208,Capital Goods,Building Materials
LOW,Lowe's Companies Inc. Common Stock,$191.32,1.14,0.599%,137225580925.00,United States,,3191815,Consumer Services,RETAIL: Building Materials
LPG,Dorian LPG Ltd. Common Stock,$13.06,-0.07,-0.533%,541752883.00,,2014,354200,Transportation,Marine Transportation
LPI,Laredo Petroleum Inc. Common Stock,$32.55,2.49,8.283%,391224179.00,United States,2011,492414,Energy,Oil & Gas Production
LPL,LG Display Co Ltd AMERICAN DEPOSITORY SHARES,$10.02,0.03,0.30%,7170626628.00,South Korea,2004,364733,Capital Goods,Industrial Machinery/Components
LPX,Louisiana-Pacific Corporation Common Stock,$56.83,1.37,2.47%,6054995939.00,United States,,1594618,Basic Industries,Forest Products
LRN,Stride Inc. Common Stock,$31.75,1.64,5.447%,1320877883.00,United States,,947482,Consumer Services,Other Consumer Services
LSI,Life Storage Inc. Common Stock,$88.21,2.26,2.629%,6656524720.00,United States,,671621,Consumer Services,Real Estate Investment Trusts
LSPD,Lightspeed POS Inc. Subordinate Voting Shares,$64.40,1.59,2.531%,8276949271.00,,,976620,Technology,Computer Software: Prepackaged Software
LTC,LTC Properties Inc. Common Stock,$43.14,1.42,3.404%,1692909587.00,United States,,212068,Consumer Services,Real Estate Investment Trusts
LTHM,Livent Corporation Common Stock,$18.81,1.49,8.603%,2757663356.00,United States,2018,3628094,Basic Industries,Major Chemicals
LU,Lufax Holding Ltd American Depositary Shares two of which representing one Ordinary Share,$14.57,0.05,0.344%,35875727318.00,China,2020,1824544,Finance,Finance: Consumer Services
LUB,Luby's Inc. Common Stock,$3.32,0.02,0.606%,102063380.00,United States,,14031,Consumer Services,Restaurants
LUMN,Lumen Technologies Inc. Common Stock,$13.11,-0.24,-1.798%,14379684726.00,United States,,14166441,Public Utilities,Telecommunications Equipment
LUV,Southwest Airlines Company Common Stock,$61.30,0.24,0.393%,36208529156.00,United States,,4974658,Transportation,Air Freight/Delivery Services
LVS,Las Vegas Sands Corp. Common Stock,$61.85,1.09,1.794%,47243685715.00,United States,2004,3917747,Consumer Services,Hotels/Resorts
LW,Lamb Weston Holdings Inc. Common Stock ,$78.08,0.60,0.774%,11427404803.00,,2016,2842690,Consumer Non-Durables,Packaged Foods
LXP,Lexington Realty Trust Common Stock,$11.48,0.37,3.33%,3186328415.00,United States,,1544915,,
LXP^C,Lexington Realty Trust  Preferred Conv. Series C,$57.36,1.04,1.847%,,United States,,4402,,
LXU,LSB Industries Inc. Common Stock,$5.31,0.18,3.509%,159500447.00,United States,,220164,Basic Industries,Major Chemicals
LYB,LyondellBasell Industries NV Ordinary Shares Class A (Netherlands),$105.55,1.50,1.442%,35267691497.00,Netherlands,,1192630,Basic Industries,Major Chemicals
LYG,Lloyds Banking Group Plc American Depositary Shares,$2.35,0.03,1.293%,41629781694.00,United Kingdom,,2761121,Finance,Commercial Banks
LYV,Live Nation Entertainment Inc. Common Stock,$88.07,3.42,4.04%,19203408537.00,United States,,2002365,Consumer Services,Services-Misc. Amusement & Recreation
LZB,La-Z-Boy Incorporated Common Stock,$43.34,0.86,2.024%,2006498675.00,United States,,227054,Consumer Durables,Home Furnishings
M,Macy's Inc Common Stock,$15.72,-0.47,-2.903%,4882120015.00,United States,,16180253,Consumer Services,Department/Specialty Retail Stores
MA,Mastercard Incorporated Common Stock,$363.30,7.25,2.036%,360888537395.00,United States,2006,3701353,Miscellaneous,Business Services
